CompanyName,Address,FullName,JapaneseCalendarReiwa,Month,Day
株式会社幸イシイ,新潟県新潟市江南区所島3-18-1所島ステージ107,黒沢菜々美,2,11,4
山田製作所アール有限会社,福岡県遠賀郡岡垣町山田1-17,唐沢公雄,2,9,8
協和工業マルナカ株式会社,高知県吾川郡いの町新町3-17-7,結城清吾,2,9,24
シーズ大翔有限会社,長野県岡谷市田中町1-4田中町ランド311,益田紅葉,2,7,26
株式会社エスプリアート,宮崎県西諸県郡高原町後川内2-15-15プレイス後川内302,瀬尾達志,2,10,14
株式会社田中商店富士商会,栃木県下野市下文狹3-1,藤森八重子,2,12,11
株式会社スペース鈴木商事,奈良県奈良市宿院町1-12-18,野村麻奈,2,8,21
有限会社山田製作所ファイン,長野県松本市村井町北1-1-19,大竹忠治,2,8,3
株式会社ジャスト佐藤組,愛媛県新居浜市中須賀町2-15-10,林田浩志,2,9,28
プラスアルファ三貴株式会社,愛媛県北宇和郡鬼北町出目3-3-18,板垣真紀子,2,11,28
林商事メイク株式会社,宮崎県宮崎市佐土原町東上那珂2-18-3,有田豊樹,3,1,11
株式会社エンゼル光和,鹿児島県鹿屋市共栄町4-2-11共栄町アパート409,滋賀貴史,2,9,18
株式会社ヒロ・コーポレーションサンエー,大阪府守口市南寺方北通2-7-15,田島絢子,2,11,11
ラポール高橋商店株式会社,香川県高松市天神前4-11-3シティ天神前400,河口和佳奈,2,9,6
アイズリンク株式会社,香川県高松市塩江町上西甲4-4-17,春日湊輝,2,10,8
株式会社輝アイネット,香川県善通寺市生野町4-2-19ロイヤル生野町105,平林正三郎,2,7,15
山崎商店ファイン株式会社,佐賀県佐賀市富士町栗並3-4-16ザ富士町栗並106,米山裕一,2,12,17
株式会社オフィスK大輝,岡山県井原市芳井町佐屋4-4-8,平井沙彩,2,8,11
ウィング森商店株式会社,愛知県名古屋市瑞穂区桜見町3-5-14,福元麻里子,2,10,1
富士商事トーワ株式会社,宮崎県児湯郡都農町川北2-7-5コート川北408,白井麻理,2,12,5
株式会社プレジールライフサポート,大分県臼杵市野津町西畑3-20,藤田陽奈,2,11,2
株式会社やまとマック,香川県善通寺市大麻町2-11-15ヴィレッジ大麻町114,深田正勝,2,9,22
有限会社セレクト三和,神奈川県横浜市神奈川区西寺尾3-15-18,尾形美怜,3,1,8
株式会社高橋商事大栄工業,千葉県市原市川在2-12ハイツ川在111,田端亜沙美,2,7,20
株式会社林商店タック,石川県小松市一針町4-10-16一針町ランド211,笹本昌幸,2,11,30
株式会社アップル加藤組,福岡県北九州市八幡西区香月西2-6-2,沢義隆,2,9,10
有限会社サンケンプロスパー,沖縄県石垣市川平1-2ロイヤルパレス川平309,青野晋,2,8,16
アルファ愛和株式会社,京都府京都市左京区修学院石掛町2-20-1,森永博道,2,8,26
クレッシェンド中村工業株式会社,岩手県滝沢市弥兵エ林4-15-5,長島穂花,2,11,6
有限会社サンフーズ誠和,福島県南会津郡南会津町塩ノ原4-14-7,志村峻輝,2,11,27
山善一有限会社,神奈川県小田原市寿町4-16-16寿町メゾン300,織田昌彦,2,7,16
株式会社リバースオクト,東京都千代田区有楽町2-14-10有楽町荘414,依田克彦,3,1,12
有限会社エフォートエトワール,岐阜県美濃市梅山町2-15-12,塚越亜希子,2,12,6
松本製作所日光有限会社,福岡県久留米市本山3-12-14,小栗綾花,2,9,23
有限会社ライフクリエイトアクティ,茨城県ひたちなか市三反田1-17プレイス三反田419,荒川茜,2,10,5
合同会社山口工業山本建設,高知県幡多郡大月町一切1-13-3,中谷芳雄,2,9,1
藤工業リバース有限会社,徳島県鳴門市大麻町高畑2-7大麻町高畑グランド303,末吉冬花,2,10,6
中村製作所石川商店株式会社,石川県加賀市大同町2-13-7大同町ヒル119,棚橋麻紀,2,10,19
ベルネクステージ合同会社,山梨県富士吉田市旭3-13,有賀隆文,2,8,15
株式会社山田工務店アクティ,福井県敦賀市櫛川町3-17タウン櫛川町412,中原雅信,2,12,2
プラスワンヤマイチ株式会社,岡山県岡山市北区中牧3-17-11,広瀬和夫,2,7,23
ひかりカラーズ有限会社,三重県鈴鹿市高岡台4-9,森島孝吉,2,8,24
佐藤商会光洋株式会社,沖縄県国頭郡今帰仁村古宇利1-5,古谷夏実,2,9,1
有限会社カトウ橋本建設,埼玉県北本市下石戸下1-3-20下石戸下コンフォート112,津村守,2,9,28
株式会社ファイン光洋,愛知県豊川市新桜町通1-17-2新桜町通シーサイド409,柏原徳美,2,9,6
有限会社松本商店ハーベスト,静岡県湖西市ときわ2-2-2,高山由利子,2,9,12
陽光ライフサービス有限会社,宮崎県東臼杵郡美郷町南郷中渡川4-13,飯野英晴,2,8,4
明光旭工業株式会社,長崎県西彼杵郡長与町高田郷4-18-13高田郷アパート301,門田俊男,2,8,12
有限会社翔栄アクセル,島根県出雲市大社町北荒木3-1-17,小山田碧,2,11,26
株式会社プラス平成,青森県弘前市富士見台3-8-13富士見台ランド414,若林沙紀,2,10,15
株式会社あさひクロス,香川県高松市扇町3-19-4,宮下明美,2,11,14
有限会社サンクスたんぽぽ,鹿児島県阿久根市波留4-13波留庵102,吉本一聡,2,10,11
株式会社高橋クライム,岩手県二戸市堀野1-17-14,馬場俊夫,2,11,24
真和オカモト株式会社,東京都三鷹市井の頭3-18-13,白木順一,2,7,29
株式会社たちばなアーバン,広島県安芸高田市高宮町房後4-16,村田真実,3,1,9
株式会社清水製作所フォーシーズン,福島県双葉郡浪江町加倉4-9-17,大浦柚花,2,7,31
有限会社ゴールドオーテック,岡山県和気郡和気町加三方4-20加三方ドリーム415,矢野長太郎,2,12,12
丸幸ライフワーク株式会社,大分県別府市小倉1-5-2シティ小倉115,小山田羽菜,2,8,30
アローズ和光商事株式会社,新潟県柏崎市扇町4-16,須田順子,2,9,2
竹内商店リアン有限会社,山梨県甲府市御岳町1-9-18,飯田誠治,2,8,8
ヤマグチアイシン株式会社,愛知県江南市赤童子町南山4-15-17コート赤童子町南山217,水谷亀太郎,2,9,8
株式会社ウイズ日東商事,沖縄県宮古島市城辺砂川3-11-9,前島真理雄,2,8,8
有限会社小林工業みやび,新潟県長岡市三ツ郷屋3-13-11,石本典子,2,10,12
株式会社アイコーポレーションサンエイ,滋賀県大津市浜大津3-20-19ダイヤモンド浜大津104,佐川杏理,2,12,13
東和工業サン商事株式会社,福井県小浜市江古川4-10-10,石垣月人,2,11,25
株式会社フジックス中村屋,鹿児島県大島郡瀬戸内町油井3-8-11,永田公男,2,9,8
山本産業丸三合同会社,熊本県球磨郡あさぎり町深田西4-14深田西グランド218,塩田健太,2,12,28
株式会社三栄商事三友商事,茨城県結城郡八千代町沼森3-3,河本実緒,2,12,11
田中建設サクセス株式会社,大阪府岸和田市戎町3-19スイート戎町419,櫻井喜美子,2,11,28
スマイルリクレイン有限会社,宮崎県日南市南郷町脇本1-19プラチナ南郷町脇本407,神田清,2,9,27
ゼロリアル株式会社,佐賀県伊万里市山代町城1-13-2,江田信吉,2,10,20
明和山口商店合資会社,宮崎県日向市伊勢ケ浜3-19,小西雅哉,2,10,6
加藤製作所サンホーム株式会社,群馬県吾妻郡中之条町平2-11-16,岩沢悟,2,12,10
日新サン商事株式会社,滋賀県長浜市七条町2-2-4プレイス七条町412,河村幸三郎,2,10,25
山崎商店リッツ株式会社,宮崎県日南市吾田西3-1-12吾田西庵216,長谷桜久良,2,11,18
株式会社グロース山田屋,奈良県橿原市忌部町3-6,河合純,2,12,12
リフレックスマスダ株式会社,広島県広島市安芸区中野4-15-9シティ中野419,高橋千鶴,2,9,21
株式会社田中工務店橋本,福岡県北九州市門司区青葉台4-14-12,赤木達雄,2,9,17
株式会社エバーグリーンサンエス,福島県西白河郡矢吹町東川原3-2-11,澤田芳久,2,9,14
ハッピーライフフェニックス株式会社,静岡県牧之原市西山寺1-4-13,福元利平,2,9,4
有限会社サカモトフィール,長野県飯田市今宮町1-15-6今宮町荘219,清水隆司,2,10,18
株式会社ディライト夢工房,熊本県玉名市岱明町下沖洲2-1-16,細野愛香,2,11,4
ワタナベハセガワ合資会社,富山県富山市長柄町2-9長柄町庵402,小嶋香織,2,7,22
山本工務店小林商事株式会社,山梨県韮崎市穂坂町柳平2-3-6,岩永聡,2,11,25
有限会社ポラリスフタバ,山梨県富士吉田市浅間2-12-3,三島洋次,2,9,28
株式会社リーフシミズ,長崎県東彼杵郡波佐見町小樽郷1-4-16コンフォート小樽郷207,近藤清一,2,10,18
コヤマケイアンドケイ株式会社,兵庫県神戸市西区岩岡町岩岡4-12-4プレイス岩岡町岩岡302,吉井凛子,2,8,24
合同会社鈴木工業ゼロワン,山口県宇部市中村1-16-10,浜崎美春,2,12,2
三友京屋株式会社,滋賀県大津市大石淀2-6-13,米田裕,2,12,29
有限会社共生ブライト,新潟県柏崎市米山町1-6-1,青木未羽,3,1,2
ネットワークミリオン有限会社,群馬県邑楽郡千代田町赤岩西3-16-7,小沢晶,3,1,13
クラフト大栄商事株式会社,大阪府南河内郡河南町芹生谷3-17-8スイート芹生谷310,堀口瑠菜,2,8,5
株式会社カトウサン企画,熊本県菊池郡菊陽町沖野2-12-16沖野シーサイド304,岩本茉莉,2,10,19
株式会社高橋組オリエント,茨城県筑西市中舘4-2-11,樋口好子,2,8,21
株式会社ダイコーコスモス,群馬県渋川市村上3-17-17,相良幸恵,2,8,25
レック森商事有限会社,北海道赤平市美園町4-2,河上和馬,3,1,14
ダイテックタスク合同会社,福井県越前市島町1-17-20,川本弘明,2,11,6
株式会社松本工業清水商店,岩手県八幡平市緑ガ丘1-4-12緑ガ丘ゴールデン305,田沢賢三,2,11,16
株式会社シンワ幸,長野県安曇野市豊科田沢2-9-5パレス豊科田沢402,浜野武秀,2,7,15
株式会社三徳シード,鹿児島県鹿児島市新島町4-7-20レジデンス新島町310,矢島奈美,2,7,15
株式会社スリーエスアクア,島根県松江市東長江町2-20-7東長江町ロイヤルパレス211,矢野時雄,2,8,17
株式会社フィール東栄,熊本県阿蘇郡小国町北里4-10タウン北里313,堀川留美,2,7,19
有限会社サンケンナカヤマ,静岡県焼津市吉津4-12-1,仲野平八郎,2,12,21
株式会社イマジン中村工業,鹿児島県枕崎市桜山町4-19ステーション桜山町211,渥美仁明,2,12,3
渡辺商店三共有限会社,岩手県一関市滝沢4-18-14,進藤亜衣,2,7,21
株式会社三幸エルム,山梨県甲斐市上菅口3-5-10,田崎美名子,2,12,26
ミウラ中村商店株式会社,福井県越前市安戸町1-1安戸町メゾン116,下村紫苑,2,10,16
株式会社共生スペース,島根県雲南市木次町宇谷1-13-10リバーサイド木次町宇谷107,細野芳彦,2,11,30
合同会社小林商店エース,徳島県鳴門市鳴門町三ツ石4-12,長谷部浩志,2,12,5
株式会社サンクチュアリマツモト,宮崎県西諸県郡高原町西麓2-14,高原優太,2,10,19
ファミリー大和商事株式会社,大阪府南河内郡河南町さくら坂南3-2-14,太田大,2,11,30
アルファーイシイ有限会社,鹿児島県いちき串木野市長崎町1-13-10長崎町ハイツ401,緒方範久,2,9,20
株式会社エステック清水商店,滋賀県犬上郡甲良町横関4-8,野田直子,2,8,7
株式会社フレンド成和,山梨県甲州市塩山西野原3-15,川村未羽,2,12,1
株式会社井上商店リンク,栃木県栃木市大森町3-8-16,増田洋二,2,9,3
ライフワークプロシード株式会社,岩手県奥州市水沢羽田町駅南2-6水沢羽田町駅南レジデンス218,狩野謙一,2,8,23
マルミフォーユー株式会社,福島県いわき市後田町4-15-8,関根駿丞,2,8,16
合同会社クレッシェンドユニバース,茨城県那珂市津田3-8-12タワー津田208,中村花凛,2,8,20
株式会社マインド山田商店,石川県白山市美里町2-15-10,片岡愛,2,8,5
橋本商事ストリーム株式会社,長野県松本市野溝木工4-15-12,中島紗英,2,7,26
東栄高橋工務店株式会社,山梨県南アルプス市田島4-3田島ハウス416,伊藤雅紹,2,12,9
有限会社グリーンハウス田中工業,群馬県館林市四ツ谷町1-17-11,菊田弥太郎,2,8,21
株式会社東洋あすか,長野県長野市戸隠栃原3-16-17,田畑雫,2,11,29
株式会社ライトスタッフ佐々木建設,青森県弘前市新寺町2-18-3コート新寺町418,小沼舞衣,2,10,7
株式会社イシイ山田製作所,京都府京都市西京区上桂東ノ口町3-7上桂東ノ口町コーポ407,中谷綾香,3,1,4
アンビシャスタチバナ株式会社,山梨県甲府市川田町3-8川田町シティ102,児玉満喜子,2,10,27
株式会社ベストライフ田中建設,和歌山県和歌山市三沢町1-7-20三沢町パーク205,西浩重,2,8,29
合資会社エステックシオン,和歌山県和歌山市薮ノ丁4-8-15薮ノ丁ロイヤルパレス400,黒木由佳,3,1,14
コーヨーサンクス株式会社,山形県西村山郡朝日町長沼1-4-3,川名治之,2,10,12
エコータカハシ株式会社,徳島県阿波市阿波町元町4-10,中塚佐知子,2,11,25
合資会社マイスター田中産業,秋田県にかほ市象潟町烏島3-2-13,布施恵美子,2,12,11
コスミックインサイト株式会社,宮崎県延岡市北川町長井3-8-20,高柳信吉,2,12,13
雅ナカノ有限会社,宮城県柴田郡柴田町剣崎2-7-15,楠信生,2,9,16
アーチ丸善有限会社,千葉県君津市人見4-18,増井清吉,2,11,14
林商店アクシス株式会社,愛媛県西条市飯岡1-6-14スイート飯岡307,古沢純,2,8,12
明和池田株式会社,岩手県八幡平市丑山口2-4-14,福山敏哉,2,10,1
株式会社トキワライト,兵庫県南あわじ市松帆脇田1-4-20,塚越勝,2,11,24
株式会社コアフジタ,富山県富山市八幡4-8八幡キャッスル208,富田眞,2,10,2
有限会社太陽商事中村組,東京都新宿区二十騎町1-6,垣内歩莉,2,12,16
東和工業松本商事合同会社,栃木県宇都宮市三番町4-3-15三番町ヒル106,奥山徳蔵,2,11,20
株式会社井上建設佐藤商会,沖縄県中頭郡西原町棚原1-17,野崎晋,2,8,4
森商店サンシャイン株式会社,熊本県水俣市白浜町4-5-17,中野凛花,2,10,5
株式会社トータルサポートフジタ,香川県丸亀市南条町2-9-19,市村華凛,2,8,6
株式会社英ナイス,山梨県中央市下河東3-7-10,村松誠之,2,10,10
サンフラワー高橋産業株式会社,沖縄県うるま市栄野比4-18-1栄野比スカイ108,坂東里佳,2,7,19
株式会社田中工務店ワーク,秋田県北秋田市七日市2-8-6タウン七日市202,南部奈央,2,7,14
大和ピュア有限会社,和歌山県有田郡湯浅町湯浅2-1-2,玉田与三郎,2,9,1
アイビースクラム有限会社,福井県福井市八重巻中町1-7八重巻中町ロイヤル416,神戸義光,2,12,22
ハーベストループ株式会社,広島県廿日市市大野奴メリ谷1-7-9ダイヤモンド大野奴メリ谷319,三木英子,2,10,5
株式会社アイハラダ,栃木県足利市井草町3-2-7,本田則明,2,8,4
アクティブ大和株式会社,愛知県豊田市舞木町4-6,高畑力,2,7,16
ウエスト太陽有限会社,千葉県長生郡一宮町宮原2-4-4,須賀篤翔,3,1,1
山本商会アイランド株式会社,北海道札幌市北区北二十一条西2-4-19北二十一条西ドリーム206,渡辺市太郎,2,11,9
株式会社石川工業東和商事,神奈川県横浜市中区西竹之丸2-2-10,北尾舞衣,3,1,11
株式会社わかばウイング,福島県須賀川市松塚4-13松塚パーク101,栗本博久,2,11,20
アイホームアビリティ合同会社,熊本県葦北郡芦北町立川3-20-17立川ステージ209,菊田利恵,2,8,21
エイコー大和産業株式会社,宮崎県えびの市柳水流2-20-6ロイヤル柳水流108,栗山善次,2,12,29
三恵三和株式会社,福島県二本松市高越屋戸4-2高越屋戸グランド307,金野里沙,2,9,20
ムラタ吉田建設有限会社,兵庫県尼崎市武庫之荘本町3-15-4コーポ武庫之荘本町115,内田憲治,2,12,8
株式会社フジイ佐々木建設,山梨県南巨摩郡身延町飯富2-12ロイヤル飯富102,蛭田奏音,2,8,16
高橋愛和有限会社,島根県松江市八束町遅江2-6-8プラチナ八束町遅江306,碓井松雄,2,8,28
日光商事佐々木工務店株式会社,香川県東かがわ市坂元3-17-13,米沢鉄雄,2,12,16
合同会社プレシャス後藤商店,秋田県湯沢市深堀2-12,池谷重樹,2,9,20
アライ豊和株式会社,千葉県東金市薄島2-20-8薄島レジデンス213,大和幸夫,2,7,29
スギヤマ共生有限会社,青森県南津軽郡藤崎町藤越2-19-10ダイヤモンド藤越212,青野三平,2,9,5
株式会社いろはウエスト,埼玉県行田市緑町3-19緑町ロイヤルパレス417,鈴木遙,2,9,23
サンコーポレーションソニック合名会社,鹿児島県奄美市名瀬朝仁新町4-1-14プラザ名瀬朝仁新町210,中塚真悠,2,9,3
株式会社三和産業マスダ,埼玉県比企郡川島町上八ツ林1-16-2,紺野友一,2,8,23
スリーエスジョイフル株式会社,東京都板橋区相生町2-7グランド相生町311,赤井公子,2,12,12
株式会社長谷川マルタカ,青森県上北郡東北町古屋敷3-10-17古屋敷プラザ403,赤井乃愛,2,9,2
大創日東商事株式会社,東京都日野市日野3-15,牧美波,2,12,9
株式会社森商店イシダ,埼玉県所沢市日吉町1-17-4日吉町ガーデン219,下田香菜,2,11,10
協和産業ヒロコーポレーション株式会社,三重県名張市百合が丘東５番町1-19-10,森永清志,2,10,13
中村建設アルス株式会社,沖縄県国頭郡本部町謝花4-5-13,麻生健夫,2,11,21
株式会社ポラリスソニック,島根県出雲市奥宇賀町4-4-5,菊田華,2,11,20
株式会社匠みらい,長野県伊那市高遠町荊口4-9高遠町荊口コート111,藤村圭,2,11,11
ヒロコーポレーション小林工業株式会社,広島県福山市神辺町新十九3-11-7神辺町新十九庵414,水田良明,3,1,12
有限会社マインドユニティ,石川県輪島市門前町田村2-6,長谷部清一郎,2,9,9
平和商事オーク有限会社,佐賀県佐賀市蓮池町見島1-7,北孝利,2,10,23
株式会社ピースイデア,長野県中野市三好町1-18-10,杉本沙也加,2,9,21
ラポールユーアイ株式会社,山梨県笛吹市八代町北3-6-14,瀬川七海,2,11,5
ウィルマツイ株式会社,岡山県倉敷市東塚2-9-10東塚プラチナ306,澤田洋平,2,7,19
株式会社ニックマルミ,香川県三豊市豊中町笠田笠岡2-7-3豊中町笠田笠岡の杜409,矢吹正博,2,9,2
スリーエス第一商事株式会社,岐阜県高山市清見町福寄2-2-12清見町福寄シティ214,塩崎琴音,2,7,26
株式会社エルム山田工務店,香川県坂出市川津町1-12-3,安斉治雄,2,12,24
共栄産業富士産業株式会社,宮城県仙台市泉区将監2-2,高瀬楓香,2,11,24
ループフジイ株式会社,千葉県木更津市本郷2-4-7テラス本郷418,青山隆冴,2,9,27
株式会社シンエイ葵,京都府宮津市獅子2-6-20ハウス獅子217,稲垣愛奈,2,10,24
株式会社ノーブルエイコー,岡山県岡山市北区久米2-16-7コーポ久米212,守屋真菜,2,11,25
コーケンシンワ株式会社,岡山県井原市美星町黒木1-20-18美星町黒木マンション203,大原愛香,2,7,24
株式会社アーネスト大和建設,佐賀県小城市小城町栗原2-12,青野伸生,2,8,14
株式会社日新テクノシステム,兵庫県神戸市灘区寺口町4-1-1ステージ寺口町116,池本兼吉,2,12,28
株式会社山口商店シンク,石川県鳳珠郡穴水町鹿上2-19,森谷弘之,2,12,1
アールナイス株式会社,徳島県海部郡海陽町芥附1-5-11,細井広重,2,8,8
株式会社太田商店和興,石川県金沢市三池町1-5三池町ダイヤモンド209,西谷健司,2,8,30
ヨシダ創研株式会社,兵庫県淡路市釜口3-3釜口フォレスト305,三村隆一郎,2,9,5
合同会社ナイスファースト,熊本県玉名郡南関町小原1-2-9,安達良二,2,11,10
有限会社三輝アズマ,香川県三豊市山本町辻1-13-13山本町辻庵214,浦田信夫,2,9,21
アレックス松本製作所株式会社,鹿児島県霧島市福山町福山1-2,入江栄一,2,10,29
ニック共栄商事有限会社,愛知県小牧市安田町3-5-4,米田春吉,2,9,11
株式会社太陽商事ジョイ,神奈川県横浜市金沢区能見台東4-2-3グリーン能見台東213,永井公子,2,9,8
あすなろウインズ株式会社,群馬県渋川市北橘町赤城山1-12-11北橘町赤城山グリーン414,田尻裕久,2,8,1
株式会社翔栄サンコーポレーション,青森県八戸市八幡3-5-5,須賀瑠璃,2,7,24
たんぽぽ樹株式会社,宮崎県西都市現王島4-19,河内凪沙,2,11,19
株式会社東和工業ループ,徳島県鳴門市瀬戸町大島田4-6-1キャッスル瀬戸町大島田216,長田真澄,2,10,18
アイコー四季有限会社,宮城県富谷市西成田3-5,荒川栄三郎,2,10,11
株式会社佐藤建設エーワン,神奈川県足柄上郡山北町谷ケ3-9,湯川康治,2,9,17
山田工務店フレンド有限会社,東京都八王子市滝山町1-6,小椋祥治,2,7,18
有限会社エイコーピュア,和歌山県有田郡有田川町西ケ峯1-7-17ステーション西ケ峯208,塚原尚子,2,12,16
株式会社丸和ジェイテック,静岡県富士宮市狩宿1-13,大村美貴子,2,7,21
新和工業プラス株式会社,岩手県奥州市衣川岩の上3-9-19プラチナ衣川岩の上104,藤木美恵子,2,8,10
アップル中村合同会社,愛知県春日井市春日井上ノ町1-10-12春日井上ノ町の杜415,玉井公平,2,12,21
株式会社クレストウィズ,香川県丸亀市南条町3-11-8シティ南条町318,新井詩,2,8,13
株式会社大和工業サンユー,岐阜県大垣市曽根町3-15ステージ曽根町407,柴田明美,2,10,16
株式会社栄和エコテック,熊本県上益城郡山都町木原谷4-7,長岡果歩,3,1,13
アップル小林商店株式会社,千葉県印旛郡栄町南ケ丘2-8-16,高原柚香,2,11,21
大栄建設大樹株式会社,愛知県江南市東野町東神田3-2-6,河村雅博,3,1,11
池田商店フォーチュン株式会社,熊本県熊本市北区麻生田3-15-6,棚橋彰,2,9,1
スギヤマ木村商事有限会社,愛知県一宮市浅井町極楽寺4-10-12,麻生衛,2,9,3
株式会社旭山一,岩手県盛岡市上厨川3-18-9,長嶋朝子,2,9,20
幸和山善株式会社,宮崎県宮崎市神宮東1-3プレシャス神宮東414,井手正則,2,9,11
株式会社たちばな山口工務店,岡山県瀬戸内市邑久町尻海4-7-16,濱田功,2,7,25
株式会社スリーエスインテック,徳島県名西郡神山町鬼籠野2-19-3,田村真澄,2,8,3
ヒロコーポレーション丸福株式会社,秋田県秋田市新屋鳥木町4-9,田沢梓,2,9,15
ゼロサクセス株式会社,三重県鈴鹿市野町西2-1-1,筒井仁一,2,12,12
有限会社藤工業小川商店,岡山県高梁市松原町大津寄4-15,沢翔太,2,12,23
永和鈴木商会株式会社,鳥取県鳥取市久末3-4-3,織田裕紀,2,7,26
福田商店佐藤工業株式会社,東京都港区南青山1-7-19,大熊風花,2,9,9
有限会社井上工業ヤマキ,島根県隠岐郡隠岐の島町西田3-8-8西田テラス209,桑原金作,2,10,7
株式会社石川商事伊藤,北海道苫小牧市有明町3-20,荒木有沙,2,12,26
株式会社エム企画アート,千葉県船橋市東船橋2-18-13東船橋スカイ219,大浦光義,2,12,24
株式会社シーズ福田商店,香川県三豊市財田町財田上2-18-15,三沢寿子,3,1,14
三栄商事モア有限会社,山形県東村山郡山辺町畑谷1-13畑谷アパート403,雨宮彩奈,2,11,9
有限会社プロテック大成産業,熊本県阿蘇市一の宮町中通4-1-6,大崎正康,2,8,19
高橋商事幸株式会社,鳥取県鳥取市国府町山根3-2-4ロイヤルパレス国府町山根212,森口優起,2,12,1
有限会社インテック山本建設,三重県桑名市梅園通3-4-1,板倉雅敏,2,8,8
トータスベルウッド株式会社,佐賀県唐津市八幡町1-20,坂井美結,2,8,30
樹田中屋合名会社,新潟県東蒲原郡阿賀町大倉甲3-13-10,末永知世,2,7,16
合同会社三徳アイテック,福岡県糟屋郡粕屋町花ヶ浦2-5-11,三橋亜美,2,11,6
イシイ菊屋株式会社,佐賀県三養基郡上峰町坊所3-9-6,山城邦彦,2,12,26
山田製作所福田商店有限会社,静岡県伊豆の国市浮橋4-16-20,長谷香里,2,12,6
有限会社エムケイ佐藤商事,沖縄県島尻郡八重瀬町大頓2-14-2大頓マンション210,小柳美香,2,7,29
アーバンみなみ株式会社,熊本県上天草市松島町合津1-4,神野順,2,9,14
株式会社大成工業山田製作所,千葉県八千代市大学町4-15,立川英子,2,9,12
株式会社アライブイーグル,埼玉県さいたま市中央区新中里3-5,嶋田大樹,2,12,20
