CompanyName,Address,FullName,JapaneseCalendarReiwa,Month,Day
井上建設佐藤株式会社,沖縄県石垣市川平1-2ロイヤルパレス川平309,青野晋,2,8,26
有限会社サンロードJIN,京都府京都市左京区修学院石掛町2-20-1,森永博道,2,9,18
株式会社山本商会ナガイ,岩手県滝沢市弥兵エ林4-15-5,長島穂花,3,1,7
中村製作所中山商株式会社,福島県南会津郡南会津町塩ノ原4-14-7,志村峻輝,2,9,13
吉田製作所シンク株式会社,神奈川県小田原市寿町4-16-16寿町メゾン300,織田昌彦,2,9,10
グロースハーモニー株式会社,東京都千代田区有楽町2-14-10有楽町荘414,依田克彦,2,12,3
ウィッシュトラスト株式会社,岐阜県美濃市梅山町2-15-12,塚越亜希子,3,1,5
株式会社石川メルシー,福岡県久留米市本山3-12-14,小栗綾花,2,11,21
和幸共栄工業株式会社,茨城県ひたちなか市三反田1-17プレイス三反田419,荒川茜,2,7,30
共栄産業ウイング有限会社,高知県幡多郡大月町一切1-13-3,中谷芳雄,2,8,23
有限会社藤和サンク,徳島県鳴門市大麻町高畑2-7大麻町高畑グランド303,末吉冬花,2,9,23
株式会社サンクチュアリフラット,石川県加賀市大同町2-13-7大同町ヒル119,棚橋麻紀,2,8,24
加藤建設ハーモニー株式会社,山梨県富士吉田市旭3-13,有賀隆文,2,12,9
ステップアイシン株式会社,福井県敦賀市櫛川町3-17タウン櫛川町412,中原雅信,2,11,16
陽光ダイコー合同会社,岡山県岡山市北区中牧3-17-11,広瀬和夫,2,10,31
アポロオリエント有限会社,三重県鈴鹿市高岡台4-9,森島孝吉,2,7,23
株式会社栄進アルカディア,沖縄県国頭郡今帰仁村古宇利1-5,古谷夏実,2,9,28
いろはリッツ合同会社,埼玉県北本市下石戸下1-3-20下石戸下コンフォート112,津村守,2,7,16
ライズダイテック株式会社,愛知県豊川市新桜町通1-17-2新桜町通シーサイド409,柏原徳美,2,9,20
株式会社グローバル松本商事,静岡県湖西市ときわ2-2-2,高山由利子,2,12,6
太田商店キタムラ株式会社,宮崎県東臼杵郡美郷町南郷中渡川4-13,飯野英晴,2,8,23
有限会社中村建設山本商店,長崎県西彼杵郡長与町高田郷4-18-13高田郷アパート301,門田俊男,2,7,20
ダイケンつるや株式会社,島根県出雲市大社町北荒木3-1-17,小山田碧,2,8,27
クリエイトオリジン株式会社,青森県弘前市富士見台3-8-13富士見台ランド414,若林沙紀,2,9,5
東和工業エスペランサ有限会社,香川県高松市扇町3-19-4,宮下明美,2,10,15
ミックパートナーズ株式会社,鹿児島県阿久根市波留4-13波留庵102,吉本一聡,2,10,16
石川工業こころ株式会社,岩手県二戸市堀野1-17-14,馬場俊夫,2,8,25
寿商事山口株式会社,東京都三鷹市井の頭3-18-13,白木順一,2,11,6
株式会社アイリス佐々木商店,広島県安芸高田市高宮町房後4-16,村田真実,2,7,17
アドバンス秀和株式会社,福島県双葉郡浪江町加倉4-9-17,大浦柚花,2,10,21
オーテックサトウ株式会社,岡山県和気郡和気町加三方4-20加三方ドリーム415,矢野長太郎,2,12,29
長谷川商店福田商店有限会社,大分県別府市小倉1-5-2シティ小倉115,小山田羽菜,2,12,16
合同会社イズミ伊藤組,新潟県柏崎市扇町4-16,須田順子,2,11,2
株式会社山善テクノス,山梨県甲府市御岳町1-9-18,飯田誠治,2,9,22
プラネットあさひ株式会社,愛知県江南市赤童子町南山4-15-17コート赤童子町南山217,水谷亀太郎,2,8,1
株式会社エヌテック一,沖縄県宮古島市城辺砂川3-11-9,前島真理雄,3,1,6
有限会社ブレインたちばな,新潟県長岡市三ツ郷屋3-13-11,石本典子,2,12,12
株式会社幸和フレンド,滋賀県大津市浜大津3-20-19ダイヤモンド浜大津104,佐川杏理,2,10,18
株式会社つるやスギヤマ,福井県小浜市江古川4-10-10,石垣月人,2,9,21
真和ヤマザキ有限会社,鹿児島県大島郡瀬戸内町油井3-8-11,永田公男,2,10,7
アイビーンズ株式会社,熊本県球磨郡あさぎり町深田西4-14深田西グランド218,塩田健太,2,8,31
株式会社鈴木組司,茨城県結城郡八千代町沼森3-3,河本実緒,2,9,22
ウイルタチバナ株式会社,大阪府岸和田市戎町3-19スイート戎町419,櫻井喜美子,2,9,13
アクロスカワイ株式会社,宮崎県日南市南郷町脇本1-19プラチナ南郷町脇本407,神田清,2,10,14
インサイト三協商事株式会社,佐賀県伊万里市山代町城1-13-2,江田信吉,2,12,12
サンエーカワイ株式会社,宮崎県日向市伊勢ケ浜3-19,小西雅哉,2,12,5
高橋商店樹株式会社,群馬県吾妻郡中之条町平2-11-16,岩沢悟,2,10,3
株式会社藤屋清水商事,滋賀県長浜市七条町2-2-4プレイス七条町412,河村幸三郎,2,10,2
有限会社太陽ティアラ,宮崎県日南市吾田西3-1-12吾田西庵216,長谷桜久良,2,8,17
TMC中村製作所株式会社,奈良県橿原市忌部町3-6,河合純,3,1,9
株式会社ユウキアート,広島県広島市安芸区中野4-15-9シティ中野419,高橋千鶴,2,8,10
株式会社日新山田製作所,福岡県北九州市門司区青葉台4-14-12,赤木達雄,3,1,11
株式会社ジェイテック昭和,福島県西白河郡矢吹町東川原3-2-11,澤田芳久,2,8,31
ヤマザキ三和建設株式会社,静岡県牧之原市西山寺1-4-13,福元利平,2,10,5
株式会社ニシムラ愛和,長野県飯田市今宮町1-15-6今宮町荘219,清水隆司,2,8,14
株式会社サンクチュアリエバーグリーン,熊本県玉名市岱明町下沖洲2-1-16,細野愛香,2,11,8
ミューズ三和工業株式会社,富山県富山市長柄町2-9長柄町庵402,小嶋香織,2,11,6
なごみアクティブ株式会社,山梨県韮崎市穂坂町柳平2-3-6,岩永聡,2,9,21
アズつばさ株式会社,山梨県富士吉田市浅間2-12-3,三島洋次,2,12,12
ヤマモトメルシー株式会社,長崎県東彼杵郡波佐見町小樽郷1-4-16コンフォート小樽郷207,近藤清一,2,11,18
ナカジマ石井商店株式会社,兵庫県神戸市西区岩岡町岩岡4-12-4プレイス岩岡町岩岡302,吉井凛子,2,11,19
合同会社大輝エスト,山口県宇部市中村1-16-10,浜崎美春,3,1,1
中村製作所池田株式会社,滋賀県大津市大石淀2-6-13,米田裕,2,11,26
合資会社丸幸イズミ,新潟県柏崎市米山町1-6-1,青木未羽,2,11,3
太陽建設佐藤工務店有限会社,群馬県邑楽郡千代田町赤岩西3-16-7,小沢晶,2,11,16
高橋産業三栄株式会社,大阪府南河内郡河南町芹生谷3-17-8スイート芹生谷310,堀口瑠菜,2,8,11
テクノニック株式会社,熊本県菊池郡菊陽町沖野2-12-16沖野シーサイド304,岩本茉莉,2,9,23
ライフワークベル株式会社,茨城県筑西市中舘4-2-11,樋口好子,2,10,25
有限会社興和エターナル,群馬県渋川市村上3-17-17,相良幸恵,2,11,26
株式会社ゼロワンエターナル,北海道赤平市美園町4-2,河上和馬,2,12,24
エコライフ東和商事株式会社,福井県越前市島町1-17-20,川本弘明,2,8,22
株式会社マツモトイーグル,岩手県八幡平市緑ガ丘1-4-12緑ガ丘ゴールデン305,田沢賢三,2,12,18
有限会社ダイイチ山本,長野県安曇野市豊科田沢2-9-5パレス豊科田沢402,浜野武秀,2,9,27
株式会社協和産業佐藤組,鹿児島県鹿児島市新島町4-7-20レジデンス新島町310,矢島奈美,2,7,20
プラネット大成株式会社,島根県松江市東長江町2-20-7東長江町ロイヤルパレス211,矢野時雄,3,1,10
伊勢屋葵株式会社,熊本県阿蘇郡小国町北里4-10タウン北里313,堀川留美,3,1,8
株式会社夢工房三和商会,静岡県焼津市吉津4-12-1,仲野平八郎,2,11,9
伊藤建設ナイス株式会社,鹿児島県枕崎市桜山町4-19ステーション桜山町211,渥美仁明,2,9,18
株式会社メイプルウインズ,岩手県一関市滝沢4-18-14,進藤亜衣,2,10,22
サクシードブライト有限会社,山梨県甲斐市上菅口3-5-10,田崎美名子,2,11,29
株式会社プロテック大東,福井県越前市安戸町1-1安戸町メゾン116,下村紫苑,2,12,29
コスモス近藤商店有限会社,島根県雲南市木次町宇谷1-13-10リバーサイド木次町宇谷107,細野芳彦,2,12,15
ネクストステージ寿商事株式会社,徳島県鳴門市鳴門町三ツ石4-12,長谷部浩志,2,11,19
田中製作所トータルサポート有限会社,宮崎県西諸県郡高原町西麓2-14,高原優太,2,9,27
成和三栄商事株式会社,大阪府南河内郡河南町さくら坂南3-2-14,太田大,2,12,21
山一小林商事株式会社,鹿児島県いちき串木野市長崎町1-13-10長崎町ハイツ401,緒方範久,2,8,13
大成松栄株式会社,滋賀県犬上郡甲良町横関4-8,野田直子,2,9,5
ナイス鈴木組株式会社,山梨県甲州市塩山西野原3-15,川村未羽,2,10,27
有限会社フリーダム平成建設,栃木県栃木市大森町3-8-16,増田洋二,2,7,24
株式会社サンユーアクロス,岩手県奥州市水沢羽田町駅南2-6水沢羽田町駅南レジデンス218,狩野謙一,2,8,19
株式会社ブロス伊藤商店,福島県いわき市後田町4-15-8,関根駿丞,2,10,14
株式会社ダイコーアート,茨城県那珂市津田3-8-12タワー津田208,中村花凛,2,11,12
エクシード コンパス有限会社,石川県白山市美里町2-15-10,片岡愛,2,8,18
株式会社岡田商店橋本,長野県松本市野溝木工4-15-12,中島紗英,2,9,4
株式会社エフ山本商事,山梨県南アルプス市田島4-3田島ハウス416,伊藤雅紹,2,10,3
株式会社藤田工業七福,群馬県館林市四ツ谷町1-17-11,菊田弥太郎,2,8,16
アイコンボハンズ株式会社,長野県長野市戸隠栃原3-16-17,田畑雫,2,9,24
日栄商事ノア株式会社,青森県弘前市新寺町2-18-3コート新寺町418,小沼舞衣,2,8,6
タツミトータルサポート株式会社,京都府京都市西京区上桂東ノ口町3-7上桂東ノ口町コーポ407,中谷綾香,2,10,27
株式会社ミリオンサンコー,山梨県甲府市川田町3-8川田町シティ102,児玉満喜子,2,11,2
マツダ協和産業株式会社,和歌山県和歌山市三沢町1-7-20三沢町パーク205,西浩重,2,10,6
有限会社富士商事サカエ,和歌山県和歌山市薮ノ丁4-8-15薮ノ丁ロイヤルパレス400,黒木由佳,2,9,2
株式会社トーヨーフジタ,山形県西村山郡朝日町長沼1-4-3,川名治之,2,12,16
株式会社藤田商店マツイ,徳島県阿波市阿波町元町4-10,中塚佐知子,2,12,2
株式会社サンエープリズム,秋田県にかほ市象潟町烏島3-2-13,布施恵美子,2,7,16
山本工務店山本工業有限会社,宮崎県延岡市北川町長井3-8-20,高柳信吉,2,10,15
株式会社グリーンハウステイクオフ,宮城県柴田郡柴田町剣崎2-7-15,楠信生,2,12,21
株式会社ダイキ興和,千葉県君津市人見4-18,増井清吉,3,1,11
大喜井上株式会社,愛媛県西条市飯岡1-6-14スイート飯岡307,古沢純,3,1,5
ファインテックイデア株式会社,岩手県八幡平市丑山口2-4-14,福山敏哉,2,8,24
伸栄佐々木工務店合資会社,兵庫県南あわじ市松帆脇田1-4-20,塚越勝,2,9,22
有限会社ひまわりセイコー,富山県富山市八幡4-8八幡キャッスル208,富田眞,2,11,21
リバースヤマト株式会社,東京都新宿区二十騎町1-6,垣内歩莉,2,7,27
株式会社カネコ山田屋,栃木県宇都宮市三番町4-3-15三番町ヒル106,奥山徳蔵,2,11,18
株式会社エムテック三貴,沖縄県中頭郡西原町棚原1-17,野崎晋,2,9,2
株式会社アウルマルキ,熊本県水俣市白浜町4-5-17,中野凛花,2,10,1
共栄商事京屋株式会社,香川県丸亀市南条町2-9-19,市村華凛,2,8,20
リッツやまと有限会社,山梨県中央市下河東3-7-10,村松誠之,2,9,11
大和産業スクラム株式会社,沖縄県うるま市栄野比4-18-1栄野比スカイ108,坂東里佳,2,11,22
東栄司株式会社,秋田県北秋田市七日市2-8-6タウン七日市202,南部奈央,2,12,23
アレス司商事株式会社,和歌山県有田郡湯浅町湯浅2-1-2,玉田与三郎,2,9,18
後藤商店大成商事合同会社,福井県福井市八重巻中町1-7八重巻中町ロイヤル416,神戸義光,2,7,31
フジタ長谷川株式会社,広島県廿日市市大野奴メリ谷1-7-9ダイヤモンド大野奴メリ谷319,三木英子,2,9,5
有限会社フジックススカイ,栃木県足利市井草町3-2-7,本田則明,2,10,20
株式会社創建双葉,愛知県豊田市舞木町4-6,高畑力,2,12,7
カネコユニックス株式会社,千葉県長生郡一宮町宮原2-4-4,須賀篤翔,2,10,27
翔栄ファインテック株式会社,北海道札幌市北区北二十一条西2-4-19北二十一条西ドリーム206,渡辺市太郎,2,11,22
シンエイ輝株式会社,神奈川県横浜市中区西竹之丸2-2-10,北尾舞衣,2,12,18
株式会社大新山田屋,福島県須賀川市松塚4-13松塚パーク101,栗本博久,2,9,10
株式会社幸エスト,熊本県葦北郡芦北町立川3-20-17立川ステージ209,菊田利恵,2,8,7
高橋商店ウィズ株式会社,宮崎県えびの市柳水流2-20-6ロイヤル柳水流108,栗山善次,2,11,16
株式会社テイクワン永和,福島県二本松市高越屋戸4-2高越屋戸グランド307,金野里沙,2,10,9
協栄リコネクト株式会社,兵庫県尼崎市武庫之荘本町3-15-4コーポ武庫之荘本町115,内田憲治,2,12,29
渡辺製作所ナカムラ株式会社,山梨県南巨摩郡身延町飯富2-12ロイヤル飯富102,蛭田奏音,2,9,24
株式会社マルタカ山田商店,島根県松江市八束町遅江2-6-8プラチナ八束町遅江306,碓井松雄,2,8,10
山田商事鈴木商事株式会社,香川県東かがわ市坂元3-17-13,米沢鉄雄,2,9,24
株式会社グリーンハウスアート,秋田県湯沢市深堀2-12,池谷重樹,2,9,4
田中建設シミズ株式会社,千葉県東金市薄島2-20-8薄島レジデンス213,大和幸夫,2,9,18
アルスナカヤマ有限会社,青森県南津軽郡藤崎町藤越2-19-10ダイヤモンド藤越212,青野三平,2,12,9
株式会社トライアングルタスク,埼玉県行田市緑町3-19緑町ロイヤルパレス417,鈴木遙,2,12,20
株式会社雅リライアンス,鹿児島県奄美市名瀬朝仁新町4-1-14プラザ名瀬朝仁新町210,中塚真悠,2,10,19
株式会社田中屋プロフィット,埼玉県比企郡川島町上八ツ林1-16-2,紺野友一,3,1,6
株式会社タスク中村製作所,東京都板橋区相生町2-7グランド相生町311,赤井公子,2,8,26
山口リード株式会社,青森県上北郡東北町古屋敷3-10-17古屋敷プラザ403,赤井乃愛,2,8,19
株式会社トーヨーエム企画,東京都日野市日野3-15,牧美波,2,8,23
メックカワムラ有限会社,埼玉県所沢市日吉町1-17-4日吉町ガーデン219,下田香菜,2,10,11
株式会社ヤマイチエヌテック,三重県名張市百合が丘東５番町1-19-10,森永清志,2,8,24
ユーテックリコネクト株式会社,沖縄県国頭郡本部町謝花4-5-13,麻生健夫,3,1,9
株式会社清水工業高橋工務店,島根県出雲市奥宇賀町4-4-5,菊田華,2,8,30
エーワンアルファ合資会社,長野県伊那市高遠町荊口4-9高遠町荊口コート111,藤村圭,2,12,13
アルス大翔株式会社,広島県福山市神辺町新十九3-11-7神辺町新十九庵414,水田良明,2,12,9
ユウキナガイ株式会社,石川県輪島市門前町田村2-6,長谷部清一郎,3,1,9
ハートランド岡田商店株式会社,佐賀県佐賀市蓮池町見島1-7,北孝利,2,8,24
リードプラウド株式会社,長野県中野市三好町1-18-10,杉本沙也加,2,10,29
リコネクト光洋株式会社,山梨県笛吹市八代町北3-6-14,瀬川七海,2,7,23
株式会社共栄建設三和商事,岡山県倉敷市東塚2-9-10東塚プラチナ306,澤田洋平,2,12,22
アルクリライアンス有限会社,香川県三豊市豊中町笠田笠岡2-7-3豊中町笠田笠岡の杜409,矢吹正博,2,12,8
コスモス三晃株式会社,岐阜県高山市清見町福寄2-2-12清見町福寄シティ214,塩崎琴音,2,11,13
イケダケイズ株式会社,香川県坂出市川津町1-12-3,安斉治雄,2,10,21
橋本工業サトウ有限会社,宮城県仙台市泉区将監2-2,高瀬楓香,2,12,10
株式会社山口建設イノウエ,千葉県木更津市本郷2-4-7テラス本郷418,青山隆冴,2,7,27
加藤商店イシカワ株式会社,京都府宮津市獅子2-6-20ハウス獅子217,稲垣愛奈,2,10,6
藤田商店アポロ有限会社,岡山県岡山市北区久米2-16-7コーポ久米212,守屋真菜,2,10,26
有限会社朝日イマジン,岡山県井原市美星町黒木1-20-18美星町黒木マンション203,大原愛香,2,10,27
ゼロトライアングル株式会社,佐賀県小城市小城町栗原2-12,青野伸生,3,1,7
マサキネクストステージ株式会社,兵庫県神戸市灘区寺口町4-1-1ステージ寺口町116,池本兼吉,3,1,3
株式会社大栄商事サイトウ,石川県鳳珠郡穴水町鹿上2-19,森谷弘之,2,8,16
合名会社中山商ピース,徳島県海部郡海陽町芥附1-5-11,細井広重,2,10,7
株式会社フリーダムイング,石川県金沢市三池町1-5三池町ダイヤモンド209,西谷健司,2,11,6
株式会社エクセル吉祥,兵庫県淡路市釜口3-3釜口フォレスト305,三村隆一郎,3,1,12
ブロス松本商事株式会社,熊本県玉名郡南関町小原1-2-9,安達良二,2,7,14
株式会社中央建設プログレス,香川県三豊市山本町辻1-13-13山本町辻庵214,浦田信夫,2,9,5
株式会社シミズアルス,鹿児島県霧島市福山町福山1-2,入江栄一,2,7,28
山田工業クラウン株式会社,愛知県小牧市安田町3-5-4,米田春吉,2,7,19
有限会社グリーン企画ユニックス,神奈川県横浜市金沢区能見台東4-2-3グリーン能見台東213,永井公子,2,9,27
有限会社わかばモア,群馬県渋川市北橘町赤城山1-12-11北橘町赤城山グリーン414,田尻裕久,2,8,3
株式会社三喜越後屋,青森県八戸市八幡3-5-5,須賀瑠璃,2,7,27
富士産業伊勢屋株式会社,宮崎県西都市現王島4-19,河内凪沙,2,12,21
株式会社テイクビクトリー,徳島県鳴門市瀬戸町大島田4-6-1キャッスル瀬戸町大島田216,長田真澄,2,9,20
リベロエコライフ株式会社,宮城県富谷市西成田3-5,荒川栄三郎,2,11,16
有限会社ヤマザキ和光商事,神奈川県足柄上郡山北町谷ケ3-9,湯川康治,3,1,12
アペックスツカサ株式会社,東京都八王子市滝山町1-6,小椋祥治,2,12,19
グリーンハウス山善合同会社,和歌山県有田郡有田川町西ケ峯1-7-17ステーション西ケ峯208,塚原尚子,2,9,11
合同会社アイテムアイム,静岡県富士宮市狩宿1-13,大村美貴子,2,8,12
ベストライフ鈴木工務店株式会社,岩手県奥州市衣川岩の上3-9-19プラチナ衣川岩の上104,藤木美恵子,2,9,6
株式会社協和産業共和,愛知県春日井市春日井上ノ町1-10-12春日井上ノ町の杜415,玉井公平,2,11,10
三陽アイム有限会社,香川県丸亀市南条町3-11-8シティ南条町318,新井詩,2,12,25
株式会社佐藤オカダ,岐阜県大垣市曽根町3-15ステージ曽根町407,柴田明美,2,11,3
株式会社リテックマックス,熊本県上益城郡山都町木原谷4-7,長岡果歩,2,7,17
株式会社菊屋越後屋,千葉県印旛郡栄町南ケ丘2-8-16,高原柚香,2,8,18
合同会社丸和パル,愛知県江南市東野町東神田3-2-6,河村雅博,2,7,27
株式会社プライム大和,熊本県熊本市北区麻生田3-15-6,棚橋彰,2,11,19
株式会社エコー大樹,愛知県一宮市浅井町極楽寺4-10-12,麻生衛,2,8,3
グローリー木村商店株式会社,岩手県盛岡市上厨川3-18-9,長嶋朝子,2,8,5
ナカノ松本工業有限会社,宮崎県宮崎市神宮東1-3プレシャス神宮東414,井手正則,2,9,29
株式会社グレースコーシン,岡山県瀬戸内市邑久町尻海4-7-16,濱田功,2,9,8
スタッフサンクチュアリ株式会社,徳島県名西郡神山町鬼籠野2-19-3,田村真澄,2,12,6
株式会社ホクトフォレスト,秋田県秋田市新屋鳥木町4-9,田沢梓,3,1,4
株式会社あさひカラーズ,三重県鈴鹿市野町西2-1-1,筒井仁一,2,9,28
有限会社クリアリコンフォート,岡山県高梁市松原町大津寄4-15,沢翔太,2,12,18
株式会社三和プラネット,鳥取県鳥取市久末3-4-3,織田裕紀,2,9,28
コンパスベストライフ株式会社,東京都港区南青山1-7-19,大熊風花,2,10,6
越後屋アップル株式会社,島根県隠岐郡隠岐の島町西田3-8-8西田テラス209,桑原金作,2,8,24
みなみガイア有限会社,北海道苫小牧市有明町3-20,荒木有沙,2,12,15
株式会社テイクワン小林建設,千葉県船橋市東船橋2-18-13東船橋スカイ219,大浦光義,2,10,30
株式会社高橋製作所山田工務店,香川県三豊市財田町財田上2-18-15,三沢寿子,2,10,15
池田商店丸正株式会社,山形県東村山郡山辺町畑谷1-13畑谷アパート403,雨宮彩奈,2,11,12
ナカノ明和工業株式会社,熊本県阿蘇市一の宮町中通4-1-6,大崎正康,2,12,3
有限会社セイワヤマモト,鳥取県鳥取市国府町山根3-2-4ロイヤルパレス国府町山根212,森口優起,2,9,3
株式会社橋本商店スカイ,三重県桑名市梅園通3-4-1,板倉雅敏,2,9,13
アイ山本商事合名会社,佐賀県唐津市八幡町1-20,坂井美結,2,10,19
有限会社リコンフォートサンライフ,新潟県東蒲原郡阿賀町大倉甲3-13-10,末永知世,2,11,5
スマイル鈴木株式会社,福岡県糟屋郡粕屋町花ヶ浦2-5-11,三橋亜美,2,11,16
ユニバースヤマイチ株式会社,佐賀県三養基郡上峰町坊所3-9-6,山城邦彦,2,11,30
ピュア未来合名会社,静岡県伊豆の国市浮橋4-16-20,長谷香里,2,10,31
有限会社ベストライフ池田,沖縄県島尻郡八重瀬町大頓2-14-2大頓マンション210,小柳美香,2,9,28
有限会社エイブル昭和,熊本県上天草市松島町合津1-4,神野順,2,8,13
株式会社大伸アレックス,千葉県八千代市大学町4-15,立川英子,2,11,1
株式会社高橋工務店サンク,埼玉県さいたま市中央区新中里3-5,嶋田大樹,2,10,4
ハーベスト田中製作所株式会社,宮崎県西諸県郡高原町蒲牟田1-19-1,高畑莉紗,2,12,20
サンエイトライアングル株式会社,群馬県伊勢崎市堤西町1-6,長崎憲治,2,9,24
ユニバースオレンジ有限会社,茨城県桜川市池亀1-3-20,長友莉生,2,11,4
株式会社サンコーポレーションアイシン,神奈川県横浜市神奈川区瑞穂町2-11-10,谷口正毅,3,1,6
株式会社メルシーオアシス,奈良県奈良市半田横町1-5-20半田横町ステーション216,大川菜々実,2,12,22
ヨシダハヤシ株式会社,栃木県宇都宮市長岡町2-17-14グリーン長岡町100,竹下喜代子,2,10,20
株式会社加藤フォース,京都府京丹後市網野町溝野1-4-17網野町溝野タワー414,小野節男,2,12,25
日光商事プレシャス株式会社,石川県金沢市飛梅町1-10-15ステーション飛梅町306,奥村和子,2,11,2
ブレイン木村商店有限会社,鳥取県鳥取市東町1-10,今川俊樹,2,10,9
大和建設フォース有限会社,鳥取県鳥取市国府町清水3-2-12,園田俊一朗,2,9,9
高橋商店ミナミ有限会社,宮城県仙台市泉区八乙女中央3-6,市原比呂,2,12,20
株式会社ウイズ高橋建設,大分県宇佐市法鏡寺3-9,海老原峻輝,2,10,24
三恵三協有限会社,佐賀県鳥栖市原古賀町4-14-15グリーン原古賀町117,山形秀之,2,7,14
有限会社イシイマーキュリー,滋賀県長浜市余呉町上丹生2-7-15余呉町上丹生タウン305,服部春代,2,8,24
有限会社マエダジャスト,山口県下松市東柳4-5-5,宮沢千代,2,9,20
アズマダイシン株式会社,佐賀県伊万里市波多津町畑津2-20プラザ波多津町畑津207,金城妃菜,3,1,3
石川商店ハート有限会社,和歌山県東牟婁郡串本町有田上1-8-5,中山和島,2,11,30
株式会社飛鳥木村建設,福岡県大牟田市西浜田町3-4-7西浜田町ゴールデン107,庄司椛,2,9,12
合名会社ヒロ・コーポレーションハーモニー,神奈川県川崎市麻生区片平4-20-9片平ガーデン206,早坂晴香,2,12,23
木村工業オリーブ株式会社,佐賀県鳥栖市水屋町4-5,湊裕仁,3,1,15
株式会社中島製作所カラーズ,佐賀県東松浦郡玄海町外津4-13-4ガーデン外津201,塩見冬楓花,3,1,1
エポック大黒屋株式会社,神奈川県横浜市瀬谷区卸本町2-17-13,日比野春名,2,7,17
株式会社エスプリ石川商店,大分県津久見市セメント町3-14セメント町フォレスト413,北尾未来,2,12,15
株式会社サンクチュアリエバーグリーン,福井県吉田郡永平寺町松岡志比堺2-7-2,那須正勝,2,7,16
セイワアルカディア株式会社,東京都新宿区二十騎町1-13-15二十騎町アパート209,高野陽菜,2,12,18
佐藤組T&T株式会社,青森県上北郡東北町乙部道ノ下4-5-13乙部道ノ下コーポ115,森山哲男,2,9,9
