CompanyName,Address,FullName,JapaneseCalendarReiwa,Month,Day
三輝サンエス株式会社,東京都新宿区二十騎町2-7パレス二十騎町306,木村康夫,2,12,20
一高橋製作所株式会社,兵庫県神戸市長田区鶯町1-5-8鶯町グリーン119,足立博子,3,1,9
クレール大成産業株式会社,岡山県高梁市成羽町吹屋4-1-19,堀口貢,2,11,12
ベルテック高橋建設株式会社,大阪府八尾市宮町1-9-18,村木尚司,2,9,17
株式会社n進興和,長野県木曽郡上松町上松2-14-16,大庭元夫,2,9,30
株式会社石井商店大成,宮城県栗原市瀬峰長根4-19プラチナ瀬峰長根108,勝田草樹,2,8,10
橋本山口工務店株式会社,大阪府堺市西区浜寺石津町東4-13-9,山岸晴子,2,11,9
鈴木工務店エコー株式会社,大阪府大阪市天王寺区味原町2-20-19,内田由良,2,8,10
株式会社小林工務店ウィング,茨城県水戸市河和田町3-18プレイス河和田町312,河口佐知子,2,12,15
扇屋ハーモニー有限会社,岐阜県関市段下3-18-1,柴田友和,2,8,25
ヤマキ東海有限会社,栃木県佐野市犬伏上町1-15-18ロイヤルパレス犬伏上町302,永野蓮,2,8,3
株式会社マルミ真和,宮城県気仙沼市唐桑町津本2-20-17ドリーム唐桑町津本100,門脇花奈,2,8,5
ウィン大成株式会社,福岡県北九州市八幡西区岸の浦4-4-6,長坂光男,2,9,17
共生藤田商店株式会社,富山県富山市八尾町竹ノ内4-9-5,郡司正夫,2,8,12
ブレインアルカディア株式会社,秋田県大仙市南外平形2-17-19南外平形プラチナ211,長崎亜久理,2,10,17
株式会社マルキ日進,高知県高岡郡四万十町野地3-4-1野地スイート316,小谷律子,2,12,28
株式会社フジックス伸和,愛媛県松山市御宝町2-13,染谷麻巳子,2,9,6
ジェイテックワーク有限会社,高知県吾川郡いの町勝賀瀬3-18-20,梅本冬萌美,2,8,12
大創ジェネシス株式会社,愛媛県伊予市平岡3-4-15,橘繁男,2,8,3
あおぞらピース株式会社,兵庫県相生市那波東本町4-7-2ゴールデン那波東本町319,松島利伸,2,7,24
クリアZERO株式会社,岡山県岡山市北区清輝本町2-5-19,石橋環菜,3,1,9
ライフサービス竹内商店有限会社,滋賀県東近江市妙法寺町4-8,金森達男,2,7,20
栄アルバ株式会社,秋田県能代市南陽崎4-7-11南陽崎レジデンス107,唐沢真一,3,1,10
合資会社三徳ワタナベ,静岡県静岡市葵区羽鳥4-13,藤沢希美,2,8,17
ウィズアイテム株式会社,千葉県成田市天浪3-1天浪荘400,菅野七美,2,11,1
ブロスフレンド株式会社,埼玉県南埼玉郡宮代町東粂原3-14-15,藤本繁雄,2,11,4
株式会社アルファハヤシ,滋賀県大津市伊香立向在地町4-7コンフォート伊香立向在地町214,岩城洋一,2,10,6
合資会社三栄ジェイテック,千葉県市原市五井金杉4-1五井金杉プレシャス419,生田伊都子,2,12,19
三和商会山本工業有限会社,千葉県君津市小市部4-19-15,浅見幸音,2,11,17
東和商事山本工務店合同会社,群馬県前橋市田口町1-1-19,福島沙良,2,10,8
パートナーズ東栄株式会社,秋田県大館市馬喰町4-6-9ロイヤル馬喰町105,大木敏仁,2,8,15
アイホームサンライフ株式会社,熊本県下益城郡美里町白石野2-18,沢文雄,2,10,21
株式会社高橋商店ミツワ,広島県神石郡神石高原町有木4-8-4有木ドリーム104,上杉京子,2,10,17
株式会社ミューズヤマキ,埼玉県羽生市上川俣4-1-10,角幸恵,2,8,25
合同会社キューブみなみ,秋田県由利本荘市岩城亀田大町1-5-8岩城亀田大町ドリーム311,川本仁美,2,7,19
スマイル大和株式会社,島根県松江市東出雲町錦浜4-17-18,茂木翔太,2,12,27
有限会社三友マエダ,沖縄県浦添市仲間2-20,草野静枝,3,1,11
有限会社エコテック北斗,京都府京都市右京区宇多野北ノ院町1-1-10ザ宇多野北ノ院町314,村田昌信,2,12,27
昭栄コスミック有限会社,香川県三豊市山本町財田西2-15レジデンス山本町財田西103,小倉博一,2,9,1
株式会社葵インフィニティ,福岡県大牟田市大黒町2-8-3,高橋貴士,2,8,23
有限会社イマイ大和興業,北海道旭川市高砂台2-16-20高砂台レジデンス305,野口和子,2,10,17
株式会社セレクトハヤシ,千葉県八千代市八千代台南4-5-12,大澤紫,2,10,18
和池田屋有限会社,埼玉県児玉郡神川町八日市3-7,久保弘美,2,10,22
有限会社エムズコーポレーションオクト,福島県伊達郡川俣町西戸ノ内1-8,吉岡鈴子,2,10,3
株式会社ポラリス太田商店,和歌山県和歌山市井戸1-14,矢吹結弦,2,9,21
株式会社フジイメルシー,茨城県鹿嶋市青塚2-13-1青塚コンフォート406,井上千春,3,1,12
中野商店オネスト株式会社,福岡県福岡市博多区中洲1-12-18,谷口数也,2,9,17
富士建設エフ株式会社,滋賀県犬上郡豊郷町下枝2-4下枝荘309,長井秀実,3,1,12
株式会社プラス石川商事,青森県西津軽郡鰺ヶ沢町一ツ森町4-13-15ロイヤルパレス一ツ森町418,福島満,2,8,28
有限会社グリーンウィル,佐賀県西松浦郡有田町山谷切口3-15ハイツ山谷切口201,石沢喜一,3,1,13
株式会社エイコーリッツ,愛媛県松山市高砂町2-1高砂町レジデンス107,岩渕若奈,2,9,7
株式会社サンセイヒロ,北海道足寄郡陸別町新町一区4-5-11レジデンス新町一区304,宍戸大造,2,9,1
株式会社小林建設ステップ,山梨県山梨市牧丘町倉科4-15タワー牧丘町倉科300,矢部健司,2,7,22
クロスロードアサヒ株式会社,徳島県徳島市三軒屋町2-2-10,野口真凛,2,11,17
有限会社丸幸三陽,鹿児島県薩摩郡さつま町平川3-9-7,中田正広,2,10,5
サンクアイ企画株式会社,宮崎県西都市藤田3-13-17,三井千絵,2,10,19
株式会社伊勢屋メイク,大阪府大阪市北区大淀南4-6-5大淀南プラチナ410,浜口杏菜,2,9,5
株式会社マルイチクレア,熊本県上益城郡山都町下市3-3-18下市プラチナ216,藤原薫理,2,12,13
大黒屋新和株式会社,大阪府大阪市淀川区野中南4-12-9野中南シーサイド204,島本恵利,3,1,4
株式会社トライアングルミリオン,宮崎県東臼杵郡門川町川内2-6-11川内キャッスル216,平松美恵子,2,9,12
株式会社栄ビジネスサポート,愛知県豊田市東保見町1-11-8東保見町パレス306,三好寅吉,2,12,1
株式会社葵富士商会,北海道函館市三森町4-5-11三森町プラザ110,坂上政子,2,8,27
株式会社アイ企画松本商事,香川県観音寺市室本町4-9-10ロイヤルパレス室本町219,喜多克海,2,9,11
株式会社サン商事セレクト,長野県長野市稲葉南俣3-4-5,沼田昇,2,10,24
株式会社イーグル藤田工業,高知県宿毛市橋上町奥奈路1-8-7橋上町奥奈路ヴィレッジ414,藤崎徳康,2,11,20
有限会社中央商事イーグル,栃木県さくら市穂積2-8-2穂積シーサイド210,森川陽華,2,12,13
リード第一商事有限会社,広島県広島市中区舟入南4-19-4,宮原泰彦,2,9,19
有限会社ユニティハセガワ,奈良県御所市増4-9-19,鮫島葵衣,2,9,19
株式会社アネックスハートランド,岐阜県瑞穂市馬場北町3-20-4メゾン馬場北町309,舟木雅博,2,10,28
吉田工務店渡辺商店株式会社,福島県喜多方市高郷町夏井1-4-14,田辺詠一,2,8,4
サンテクノロイヤル有限会社,広島県尾道市瀬戸田町荻4-4瀬戸田町荻ハウス113,江原杏子,2,9,4
石川ティーズ株式会社,山梨県北都留郡丹波山村御祭1-17-18,大滝国男,2,12,29
ブライト渡辺製作所株式会社,京都府京都市上京区安楽小路町2-11-15安楽小路町パーク204,安達鉄夫,2,10,28
有限会社ナックエバーグリーン,奈良県天理市稲葉町2-19稲葉町ステーション318,山岡隼人,2,10,1
合同会社アプローズビーンズ,富山県富山市水橋中町2-10-10,福地一仁,2,12,9
株式会社田中屋光陽,香川県高松市塩屋町1-14テラス塩屋町411,赤井由夫,2,10,5
ヤマダアイコー有限会社,茨城県常総市大輪町2-5-11,竹村紗英,2,8,27
有限会社ウェーブキタムラ,大分県大分市旭町1-8-4旭町フォレスト407,石渡裕真,2,9,22
株式会社三宝イースト,香川県仲多度郡多度津町山階3-6-8,高木金弥,2,11,11
一心マツイ株式会社,福井県坂井市丸岡町高柳1-9レジデンス丸岡町高柳203,大西広吉,2,7,31
株式会社平和商事ヤマザキ,岐阜県羽島市下中町市之枝1-1-16,鵜飼喜一,2,11,18
株式会社ベルテック明和工業,山形県西置賜郡小国町大宮3-14-1大宮ヒル308,鬼頭慶一,3,1,13
イトウクロス有限会社,徳島県阿波市阿波町南谷島2-19-17,古山深雪,2,10,16
林工業丸善株式会社,滋賀県長浜市千草町2-2-16レジデンス千草町100,落合椿,2,8,18
株式会社寿産業アクアテック,秋田県にかほ市象潟町大飯郷4-8-16象潟町大飯郷プレシャス109,土田哲雄,2,8,4
三和産業サポート株式会社,宮城県亘理郡山元町浅生原3-8,丸山航陽,3,1,10
株式会社近藤商店日光商事,島根県安来市伯太町須山福冨1-11-15伯太町須山福冨ゴールデン407,中原俊博,2,9,6
みどり光栄株式会社,栃木県下都賀郡壬生町大師町1-19-3大師町荘403,岡田小百合,2,12,30
株式会社ファインテックアイム,東京都千代田区有楽町2-8-12,長沢夏希,2,8,12
佐藤組ケイテック有限会社,岡山県倉敷市浜町1-10-18,川本沙和,2,12,8
アークスエコシステム有限会社,鹿児島県大島郡龍郷町玉里4-20玉里コーポ401,峰花恋,2,11,11
協和産業アクティ株式会社,埼玉県久喜市樋ノ口2-18-19,長崎良子,2,11,27
株式会社佐藤組林商事,東京都中央区日本橋横山町3-16日本橋横山町グランド117,松岡一憲,2,10,24
株式会社エトワールオーシャン,福岡県朝倉市杷木白木4-14-5杷木白木ランド109,坪田風凛,2,7,17
サンプラウド株式会社,埼玉県加須市中樋遣川3-5-18中樋遣川スイート411,大石芳久,2,9,8
株式会社小林商事ロイヤル,三重県四日市市山田町1-15-1,白木萌葉,2,9,26
株式会社フジタ後藤商店,兵庫県たつの市誉田町広山3-6-6,高原省三,3,1,1
株式会社アローズフォレスト,山形県鶴岡市羽黒町富沢3-5-2羽黒町富沢ドリーム219,堤英治,2,9,23
中村商店ケイテック株式会社,島根県浜田市長見町4-14,野原歌音,2,8,13
株式会社北斗マルワ,島根県雲南市大東町仁和寺1-13-1フォレスト大東町仁和寺315,亀山淑子,2,8,4
株式会社三共サトウ,佐賀県西松浦郡有田町赤絵町2-17-12,村上良彦,2,9,14
アンジュ中央商事有限会社,新潟県村上市山田4-5,長嶋満喜子,2,12,27
株式会社フレンズケイテック,和歌山県紀の川市貴志川町上野山3-12-19,藤井舞桜,2,7,17
サカイテクノ株式会社,熊本県熊本市西区小島上町1-8-19,樋口照,2,12,15
株式会社アイワライフクリエイト,群馬県吾妻郡中之条町赤坂4-18,柴田晴香,3,1,11
ホープアレス合名会社,山梨県北杜市長坂町長坂上条3-10-10,赤木時雄,2,7,17
株式会社松栄太陽商事,福岡県みやま市瀬高町大廣園2-5瀬高町大廣園シーサイド405,山城藍,2,10,12
ウイズアクシス有限会社,三重県三重郡菰野町田光1-8-7,原口碧衣,2,9,20
松本建設鈴木工業株式会社,栃木県佐野市相生町3-10-13相生町シーサイド116,柳瀬沙耶,2,10,17
結マルヨシ株式会社,新潟県新発田市野中3-18-9野中メゾン313,角田政人,2,11,10
リンクスシオン株式会社,群馬県邑楽郡邑楽町明野2-2,田中義治,2,11,12
株式会社エム企画コスミック,京都府京都市南区唐橋井園町3-13-1,楠本秀雄,3,1,9
リバティーあすなろ株式会社,熊本県玉名市片諏訪2-6,森雫,2,12,17
エクシード たんぽぽ有限会社,和歌山県和歌山市東布経丁4-14-4,大和有里,2,12,19
藤田商店エクシード 株式会社,山形県酒田市地見興屋1-11-19地見興屋ランド106,横川莉央,2,8,13
コーエイフォース株式会社,宮崎県都城市高崎町縄瀬3-8高崎町縄瀬ステーション410,井出優香,2,11,11
株式会社中川商店四季,岐阜県飛騨市河合町稲越1-3,相馬千夏,2,9,30
ステップエポック株式会社,和歌山県日高郡印南町古屋4-18,小笠原義夫,2,11,22
アイコーポレーションオーテック株式会社,京都府相楽郡精華町柘榴1-10-5,杉本雪菜,2,8,14
田中商店大成株式会社,鳥取県米子市岩倉町4-10ステーション岩倉町208,片山杏菜,2,12,17
合同会社ノーブル共栄産業,京都府京都市伏見区醍醐柿原町4-15-20ゴールデン醍醐柿原町219,辻本芽生,2,10,22
三友商事アイランド株式会社,徳島県那賀郡那賀町横谷1-18-5横谷フォレスト204,岩城信長,3,1,5
ネクサスサカイ有限会社,大分県大分市王子南町4-2-19,雨宮良二,2,10,5
井上建設ストリーム株式会社,長崎県諫早市土師野尾町1-16-8コンフォート土師野尾町102,三島昌利,2,11,9
トーヨージャスト株式会社,奈良県大和郡山市千日町3-14,北原茉奈,2,12,3
株式会社岡田商店グロウ,山梨県南都留郡道志村椿1-8-5,木村日出夫,2,9,25
シンコーコーエイ株式会社,広島県広島市東区尾長西2-13-18尾長西スカイ406,伊藤敦子,2,12,4
新生協栄株式会社,秋田県にかほ市象潟町小烏島1-6-2象潟町小烏島グリーン403,竹田綾,2,11,28
共生リッツ株式会社,富山県富山市二口町2-15-16二口町レジデンス407,李利恵,2,8,7
株式会社大樹ホクシン,愛媛県松山市道後多幸町3-12キャッスル道後多幸町209,栗田優那,2,9,12
セントラルエール有限会社,岡山県新見市井倉4-18,矢沢文人,2,12,23
ネットワーク佐藤興業有限会社,石川県白山市小柳町2-11-16,阿久津充,3,1,8
株式会社ティアラ清水商店,神奈川県相模原市中央区南橋本2-16-7南橋本の杜409,沢啓介,2,12,28
株式会社プラスアルファアトム,東京都江戸川区東葛西4-9-3,河崎果凛,2,11,3
株式会社富士工業サンユー,和歌山県和歌山市田野2-16,村瀬浩秋,3,1,7
株式会社あすなろ鈴木商事,鳥取県西伯郡大山町御来屋3-12-15御来屋アパート218,小島素子,2,8,18
リトルミエールM&M合資会社,宮崎県日南市南郷町榎原4-20,菊地喜太郎,3,1,15
ライト三和株式会社,千葉県野田市桐ケ作3-6,小高秀夫,2,8,27
合名会社アトム高橋商店,北海道留萌市元町2-19,柳原冨美子,3,1,14
有限会社和楽ミリオン,東京都世田谷区砧公園3-12-13ヴィレッジ砧公園419,滋賀心乃葉,2,9,23
オカダフクダ株式会社,大阪府茨木市東安威3-9,今井光義,2,8,27
サンシステム富士有限会社,神奈川県横浜市旭区今宿東町4-18,森口幸四郎,2,11,2
キタムラアドバンス有限会社,石川県七尾市鵜浦町3-14,寺岡秀一,2,10,12
アステックアズマ株式会社,北海道稚内市末広1-12-8,竹田直也,2,12,11
アクシスロード有限会社,兵庫県多可郡多可町八千代区門田1-14,藤野真奈,2,8,20
スクエアセントラル有限会社,岡山県岡山市北区中牧4-5中牧コート317,東山久道,2,9,15
マルイ栄光株式会社,山梨県大月市初狩町下初狩4-4-7,羽鳥哲男,2,7,24
サンフーズ栄和有限会社,沖縄県国頭郡本部町山里1-15-6,青柳梨紗,2,10,9
株式会社鈴木工務店飛翔,北海道上川郡清水町本通西1-12-10,横井朋美,2,8,23
株式会社木村工業渡辺建設,熊本県菊池市七城町水次4-19-13タウン七城町水次219,林龍也,2,12,17
ササキハイテック株式会社,和歌山県田辺市本宮町土河屋1-13-5,長瀬進,2,7,19
ゼストリアライズ株式会社,山梨県南巨摩郡身延町梅平1-4梅平メゾン414,岡本政信,2,11,10
オネスト山本株式会社,静岡県掛川市沢田2-3-10,浅見鑑,2,11,24
株式会社マルヨシクレア,滋賀県高島市マキノ町浦3-6-2グランドマキノ町浦109,広川依子,2,11,23
ベストディライト株式会社,福島県いわき市三沢町3-3,若林清三,2,8,17
栄加藤組株式会社,鳥取県米子市岡成3-11-2岡成プラチナ408,松島碧透,2,10,9
有限会社エトワールロード,千葉県柏市布施新町1-18-18布施新町マンション100,末永果歩,2,8,4
合資会社シグマスギヤマ,新潟県新潟市西蒲区国見1-13-13コート国見214,椎名竜夫,2,12,7
株式会社藤田工業レジェンド,香川県東かがわ市入野山4-7,西島貴利也,2,10,17
松本佐々木工務店合同会社,鳥取県岩美郡岩美町唐川1-1-20唐川ドリーム419,飛田友香,2,11,16
松屋フルハウス株式会社,青森県黒石市弥生町1-4弥生町レジデンス215,生田佐一,2,12,7
幸和クラウド株式会社,栃木県那須塩原市清住町3-6-10清住町ヒル101,川井悟,2,9,26
アレックスベスト株式会社,三重県桑名市北川原台3-20-1,伊藤雫,2,12,6
有限会社エコーフリースタイル,長野県飯山市飯山3-12-10飯山レジデンス103,高倉美優,2,8,7
株式会社扇屋一心,石川県加賀市山代温泉桜町1-19ヴィレッジ山代温泉桜町310,丹野薫,2,8,27
株式会社グローリー木村建設,千葉県夷隅郡大多喜町紺屋2-14-11,安東政人,2,8,27
ダイケンアドヴァンス株式会社,福井県福井市灯明寺町1-20-15,松原花華,2,7,25
サンケンライズ株式会社,奈良県奈良市中貫町1-15-17中貫町フォレスト118,上条和馬,2,7,28
ワイテックマルワ合同会社,長野県飯田市吾妻町1-13-18,高嶋雅典,2,7,21
マインドフラット株式会社,茨城県水戸市小泉町2-4-4コーポ小泉町107,長谷部真吉,3,1,12
トラスト協和産業株式会社,佐賀県唐津市魚屋町3-1,西山華凛,2,11,30
株式会社ウェーブナカヤマ,三重県伊賀市緑ケ丘中町1-4-20緑ケ丘中町コーポ410,今昌一郎,2,9,24
株式会社ロード三協,奈良県吉野郡十津川村永井3-4-4,森本烈,2,11,25
たちばな伊藤商事株式会社,山梨県山梨市三富下荻原2-16-10,西岡日奈,2,8,21
株式会社ベスト山田工務店,佐賀県唐津市浦3-15-17リバーサイド浦114,倉橋葉月,2,10,11
渡辺製作所ロイヤル合同会社,秋田県大仙市刈和野3-8-7,浜田良三,2,12,15
株式会社アペックス伊藤,大分県日田市殿町3-13,林祐子,2,12,24
株式会社井上商事田中工業,大分県由布市挾間町谷4-2,梶原紗菜,2,11,20
ベストライフササキ株式会社,兵庫県姫路市網干区坂出3-19-8網干区坂出ゴールデン302,上杉沙弥,2,10,1
株式会社ロータスロイヤル,山梨県山梨市牧丘町室伏4-7-4牧丘町室伏グランド107,福島源治,2,10,4
ゼストワタナベ株式会社,三重県多気郡多気町上出江4-18-5,浜本昭,2,8,13
朝日商事シード株式会社,徳島県鳴門市瀬戸町大島田4-20ハウス瀬戸町大島田401,植田颯雅,3,1,6
株式会社ダイコーアドヴァンス,広島県尾道市西御所町2-6ステーション西御所町219,大坪桃花,2,10,12
ユニオンダイセン株式会社,神奈川県横須賀市米が浜通4-11-15,杉田英倫,2,11,14
株式会社幸栄ワタナベ,山梨県北杜市高根町村山西割3-13-4,小川佳那子,2,10,19
ベストフジコーポレーション株式会社,徳島県海部郡海陽町船津3-1-12,鹿野市太郎,2,9,16
株式会社リバース越後屋,和歌山県東牟婁郡古座川町大桑4-12-12,海老原俊明,2,9,22
グッドライフハピネス株式会社,新潟県柏崎市西山町和田4-14-10,恩田亜沙美,2,11,27
司工業山善有限会社,和歌山県和歌山市吉礼3-10-12吉礼の杜202,仲村好子,2,11,14
伊藤製作所リラック株式会社,大分県玖珠郡九重町粟野1-8-15,手塚正俊,2,7,14
株式会社マルワリコネクト,鹿児島県曽於市財部町南俣2-18-1ザ財部町南俣202,森勇夫,2,7,31
株式会社ナックマルタカ,岡山県倉敷市祐安4-17,山村雅江,2,11,2
大輝東栄株式会社,熊本県玉名郡和水町大田黒1-20,大西房子,2,12,8
有限会社三栄商事高橋工務店,宮崎県児湯郡都農町川北4-12川北グランド208,飯塚真澄,2,12,13
シリウスオネスト有限会社,青森県三戸郡五戸町扇田1-2メゾン扇田202,曽我伊吹,2,8,2
株式会社トキワサンホーム,岡山県苫田郡鏡野町至孝農4-12-18,鈴木啓之,3,1,2
株式会社鈴木工務店トップス,奈良県北葛城郡広陵町古寺3-1-4ガーデン古寺215,恩田博子,2,12,25
株式会社フィールドタムラ,大阪府大阪市鶴見区緑4-7-7,浜愛海,2,11,3
ヒロコーポレーション正和有限会社,秋田県仙北市角館町鳥木沢3-14-4,藤田南,2,10,7
株式会社加藤製作所ハピネス,静岡県島田市日之出町2-18-3,小川克彦,2,9,20
株式会社山田屋メルシー,群馬県伊勢崎市東小保方町3-14-6,秋山三雄,2,9,15
エイコータケダ株式会社,山梨県南アルプス市榎原1-10,岩間敦,2,11,1
昭和アール株式会社,岩手県一関市城内3-4,上村眞子,2,10,28
有限会社加藤建設リコンフォート,京都府京都市下京区坊門中之町1-20-9,玉城朋美,2,8,28
合資会社アクセルタケダ,熊本県玉名郡玉東町白木1-6-19,川田昌己,2,10,13
アイズタック株式会社,埼玉県鶴ヶ島市松ヶ丘3-16-19グランド松ヶ丘416,赤塚藤雄,2,12,24
株式会社ハピネスハーベスト,長崎県諫早市本町4-12-7本町コンフォート400,須賀涼花,2,11,15
株式会社ユニテック渡辺工務店,千葉県旭市野中4-15-15,三木航平,2,12,2
合名会社パレットフジケン,岩手県八幡平市左妻3-1-4メゾン左妻403,坂本栞奈,2,7,24
コスモテック彩株式会社,愛知県尾張旭市西大道町五輪塚4-17-4西大道町五輪塚スカイ311,岩城重信,2,8,11
光栄プロテック有限会社,東京都豊島区南池袋2-12-2,久保田有彩,2,11,2
株式会社サンエイサン企画,千葉県旭市倉橋2-7-2,亀山正道,2,12,14
エムズコーポレーション明和工業株式会社,宮城県栗原市瀬峰蔵王3-20-13,吉村豊作,2,11,3
株式会社ワークスオリオン,青森県弘前市北横町2-18-3,高柳里奈,2,12,15
株式会社ゼストアーネスト,福岡県遠賀郡水巻町高松2-3高松メゾン111,佐伯義美,2,12,17
株式会社ハヤシ一,群馬県太田市泉町3-10-16,結城靖彦,2,9,17
株式会社光陽ユタカ,鳥取県西伯郡南部町宮前2-10宮前ランド411,小幡理緒,2,11,19
株式会社中島製作所サカモト,三重県津市安濃町川西2-2-11,神山耕筰,2,9,7
昭和産業高橋産業株式会社,鳥取県鳥取市国府町菅野2-12-13,後藤亀太郎,2,11,10
株式会社大和スタッフ,栃木県那須郡那須町高久乙4-14,柴田虎雄,2,7,14
大和産業前田商店株式会社,和歌山県東牟婁郡那智勝浦町中ノ川3-16-6コーポ中ノ川112,長谷部信玄,2,11,25
山田商事タチバナ株式会社,熊本県阿蘇市一の宮町坂梨4-20-2シティ一の宮町坂梨100,木内綾菜,2,10,2
株式会社エルムフタバ,山梨県南都留郡西桂町小沼2-5-15,安井順一,2,9,9
プラネット鈴木商店有限会社,大分県中津市八幡町3-17八幡町プラチナ213,岩永久寛,2,9,27
株式会社ピース佐藤建設,兵庫県西脇市平野町2-12-13平野町アパート415,佐川柚希,2,9,5
有限会社中村商店リバティ,宮崎県都城市郡元3-1,桜井真樹,2,9,25
ひかり佐藤商事株式会社,熊本県山鹿市宗方3-11,新保司,2,9,2
サカエ平成株式会社,宮崎県日向市亀崎西4-1-20,長谷部留子,2,8,21
大新エイト有限会社,宮城県気仙沼市本吉町狼の巣2-10本吉町狼の巣シーサイド307,植松重吉,3,1,6
エムズ橋本建設株式会社,高知県高岡郡日高村本郷1-1-8本郷アパート103,野崎悠奈,2,9,13
株式会社栄フジケン,香川県丸亀市中府町2-16-18ガーデン中府町302,本橋祐一郎,2,7,25
コーエイSKY合同会社,佐賀県伊万里市山代町久原1-18-5グランド山代町久原106,田畑尚美,2,8,18
コジマ山田製作所株式会社,神奈川県横浜市中区元町2-20,岡本莉桜,2,12,14
三和建設ハンズ株式会社,静岡県静岡市葵区口仙俣4-8-8,川村麻衣子,2,10,16
成和サンコー株式会社,北海道空知郡南幌町南１６線西1-17-8,熊倉鉄太郎,2,9,12
株式会社オガワテクノ,東京都新宿区二十騎町3-13-18,瀬尾洋平,2,12,19
小林工業共立有限会社,沖縄県浦添市伊祖4-15-6伊祖パーク304,岡山博満,2,10,14
丸三共栄工業株式会社,新潟県長岡市麻生田町4-8-10,矢口敬子,2,8,22
太陽サクシード株式会社,徳島県鳴門市瀬戸町撫佐1-5-6,平田晴雄,2,8,31
株式会社アンビシャスヤマグチ,滋賀県長浜市高月町落川4-18,吉沢梨紗,2,10,15
株式会社トーワタイセイ,愛媛県伊予郡松前町筒井4-7-11ロイヤル筒井405,木本信子,2,8,13
株式会社イシイダイイチ,千葉県我孫子市布佐下新田1-16布佐下新田ランド105,沢柚希,2,10,1
