CompanyName,Address,FullName,JapaneseCalendarReiwa,Month,Day
サンコーポレーション創研株式会社,秋田県由利本荘市岩城亀田大町1-5-8岩城亀田大町ドリーム311,川本仁美,2,10,9
株式会社キタムラジャスト,島根県松江市東出雲町錦浜4-17-18,茂木翔太,2,11,11
アッシュ橋本工業株式会社,沖縄県浦添市仲間2-20,草野静枝,2,11,4
ノア松本株式会社,京都府京都市右京区宇多野北ノ院町1-1-10ザ宇多野北ノ院町314,村田昌信,2,7,24
株式会社フィールド加藤工務店,香川県三豊市山本町財田西2-15レジデンス山本町財田西103,小倉博一,2,11,6
株式会社トップ栄光,福岡県大牟田市大黒町2-8-3,高橋貴士,2,9,16
あすなろ山本組有限会社,北海道旭川市高砂台2-16-20高砂台レジデンス305,野口和子,2,12,3
フジケン伊藤工業株式会社,千葉県八千代市八千代台南4-5-12,大澤紫,2,11,15
有限会社グローバル井上,埼玉県児玉郡神川町八日市3-7,久保弘美,2,12,1
株式会社新栄伊藤建設,福島県伊達郡川俣町西戸ノ内1-8,吉岡鈴子,2,12,24
丸福ハーモニー合資会社,和歌山県和歌山市井戸1-14,矢吹結弦,2,8,28
株式会社三喜クローバー,茨城県鹿嶋市青塚2-13-1青塚コンフォート406,井上千春,2,12,16
株式会社コーケンエコライフ,福岡県福岡市博多区中洲1-12-18,谷口数也,3,1,13
ジャスティス松本工業株式会社,滋賀県犬上郡豊郷町下枝2-4下枝荘309,長井秀実,2,8,11
ウインズクラウド株式会社,青森県西津軽郡鰺ヶ沢町一ツ森町4-13-15ロイヤルパレス一ツ森町418,福島満,2,12,20
株式会社タケダツカサ,佐賀県西松浦郡有田町山谷切口3-15ハイツ山谷切口201,石沢喜一,2,12,23
マエダマルミ株式会社,愛媛県松山市高砂町2-1高砂町レジデンス107,岩渕若奈,2,10,26
ワイズ司工業株式会社,北海道足寄郡陸別町新町一区4-5-11レジデンス新町一区304,宍戸大造,2,8,22
カワムラグロウ株式会社,山梨県山梨市牧丘町倉科4-15タワー牧丘町倉科300,矢部健司,2,9,19
アイ企画つるや株式会社,徳島県徳島市三軒屋町2-2-10,野口真凛,2,8,16
有限会社アプローズマルミ,鹿児島県薩摩郡さつま町平川3-9-7,中田正広,2,9,12
株式会社清水工業アイシン,宮崎県西都市藤田3-13-17,三井千絵,2,12,6
株式会社清水商店ワイテック,大阪府大阪市北区大淀南4-6-5大淀南プラチナ410,浜口杏菜,2,9,12
有限会社三栄商事サンシャイン,熊本県上益城郡山都町下市3-3-18下市プラチナ216,藤原薫理,2,10,3
株式会社協和工業アップル,大阪府大阪市淀川区野中南4-12-9野中南シーサイド204,島本恵利,2,7,19
有限会社コスミック池田,宮崎県東臼杵郡門川町川内2-6-11川内キャッスル216,平松美恵子,2,11,23
池田建設グローバル株式会社,愛知県豊田市東保見町1-11-8東保見町パレス306,三好寅吉,2,10,26
株式会社石川商事プロテック,北海道函館市三森町4-5-11三森町プラザ110,坂上政子,2,8,9
サンクス三和建設株式会社,香川県観音寺市室本町4-9-10ロイヤルパレス室本町219,喜多克海,2,9,8
マルタカウイル株式会社,長野県長野市稲葉南俣3-4-5,沼田昇,2,7,27
株式会社池田商店エール,高知県宿毛市橋上町奥奈路1-8-7橋上町奥奈路ヴィレッジ414,藤崎徳康,2,9,29
株式会社信和三栄商事,栃木県さくら市穂積2-8-2穂積シーサイド210,森川陽華,2,7,17
中島製作所日昇合同会社,広島県広島市中区舟入南4-19-4,宮原泰彦,2,10,19
有限会社スリーエスフィールド,奈良県御所市増4-9-19,鮫島葵衣,2,10,24
フォーシーズン清水工業有限会社,岐阜県瑞穂市馬場北町3-20-4メゾン馬場北町309,舟木雅博,2,10,19
ハシモト長谷川商店株式会社,福島県喜多方市高郷町夏井1-4-14,田辺詠一,2,11,29
輝オガワ株式会社,広島県尾道市瀬戸田町荻4-4瀬戸田町荻ハウス113,江原杏子,2,8,5
株式会社エフォートリアライズ,山梨県北都留郡丹波山村御祭1-17-18,大滝国男,2,9,22
加藤商事井上建設株式会社,京都府京都市上京区安楽小路町2-11-15安楽小路町パーク204,安達鉄夫,2,10,22
株式会社ウイルフェニックス,奈良県天理市稲葉町2-19稲葉町ステーション318,山岡隼人,2,9,17
株式会社田中建設フジイ,富山県富山市水橋中町2-10-10,福地一仁,2,11,5
株式会社ミウラアート,香川県高松市塩屋町1-14テラス塩屋町411,赤井由夫,2,8,5
株式会社佐藤工務店鈴木製作所,茨城県常総市大輪町2-5-11,竹村紗英,2,10,2
トップ長谷川合同会社,大分県大分市旭町1-8-4旭町フォレスト407,石渡裕真,2,11,12
サンテックオーシャン株式会社,香川県仲多度郡多度津町山階3-6-8,高木金弥,2,7,25
株式会社ネクスト池田建設,福井県坂井市丸岡町高柳1-9レジデンス丸岡町高柳203,大西広吉,2,10,22
旭商事木村建設株式会社,岐阜県羽島市下中町市之枝1-1-16,鵜飼喜一,2,7,26
株式会社池田工業アイテム,山形県西置賜郡小国町大宮3-14-1大宮ヒル308,鬼頭慶一,2,12,12
アクティ英株式会社,徳島県阿波市阿波町南谷島2-19-17,古山深雪,2,11,17
ニックJIN株式会社,滋賀県長浜市千草町2-2-16レジデンス千草町100,落合椿,3,1,7
スタイルフラット株式会社,秋田県にかほ市象潟町大飯郷4-8-16象潟町大飯郷プレシャス109,土田哲雄,2,7,29
ハセガワ吉田産業株式会社,宮城県亘理郡山元町浅生原3-8,丸山航陽,2,12,5
オフィスKイーグル有限会社,島根県安来市伯太町須山福冨1-11-15伯太町須山福冨ゴールデン407,中原俊博,2,11,26
株式会社アスクセイコー,栃木県下都賀郡壬生町大師町1-19-3大師町荘403,岡田小百合,2,8,2
株式会社アズハート,東京都千代田区有楽町2-8-12,長沢夏希,2,7,26
株式会社プラスワンアイホーム,岡山県倉敷市浜町1-10-18,川本沙和,2,9,28
株式会社サンフラワーウチダ,鹿児島県大島郡龍郷町玉里4-20玉里コーポ401,峰花恋,2,11,5
ライフテクノス株式会社,埼玉県久喜市樋ノ口2-18-19,長崎良子,2,11,18
株式会社ジャスティスナチュラル,東京都中央区日本橋横山町3-16日本橋横山町グランド117,松岡一憲,2,12,3
石川協和産業有限会社,福岡県朝倉市杷木白木4-14-5杷木白木ランド109,坪田風凛,2,9,18
小林商店松本工業株式会社,埼玉県加須市中樋遣川3-5-18中樋遣川スイート411,大石芳久,2,7,26
株式会社テイクオフ和光商事,三重県四日市市山田町1-15-1,白木萌葉,2,10,24
太田商店リコンフォート合同会社,兵庫県たつの市誉田町広山3-6-6,高原省三,2,10,17
フューチャーライフワーク株式会社,山形県鶴岡市羽黒町富沢3-5-2羽黒町富沢ドリーム219,堤英治,2,9,7
トップコーケン株式会社,島根県浜田市長見町4-14,野原歌音,3,1,1
株式会社和幸ひかり,島根県雲南市大東町仁和寺1-13-1フォレスト大東町仁和寺315,亀山淑子,2,8,23
株式会社アイコーポレーションやまと,佐賀県西松浦郡有田町赤絵町2-17-12,村上良彦,2,12,20
株式会社ダイチつるや,新潟県村上市山田4-5,長嶋満喜子,3,1,6
株式会社エール富士商事,和歌山県紀の川市貴志川町上野山3-12-19,藤井舞桜,2,11,9
株式会社藤幸和,熊本県熊本市西区小島上町1-8-19,樋口照,2,11,6
石井商店藤田工業株式会社,群馬県吾妻郡中之条町赤坂4-18,柴田晴香,2,8,8
鈴木製作所ティアラ株式会社,山梨県北杜市長坂町長坂上条3-10-10,赤木時雄,2,10,15
株式会社アルバサンク,福岡県みやま市瀬高町大廣園2-5瀬高町大廣園シーサイド405,山城藍,2,10,1
マツダネクストワン株式会社,三重県三重郡菰野町田光1-8-7,原口碧衣,2,10,24
ウインエンゼル株式会社,栃木県佐野市相生町3-10-13相生町シーサイド116,柳瀬沙耶,2,12,16
雅協和商事株式会社,新潟県新発田市野中3-18-9野中メゾン313,角田政人,2,9,9
新栄工業サイトウ株式会社,群馬県邑楽郡邑楽町明野2-2,田中義治,2,9,27
中村産業ナカジマ株式会社,京都府京都市南区唐橋井園町3-13-1,楠本秀雄,2,10,8
NEXTサンシステム株式会社,熊本県玉名市片諏訪2-6,森雫,2,9,12
株式会社大翔オリオン,和歌山県和歌山市東布経丁4-14-4,大和有里,2,8,6
清和コジマ合同会社,山形県酒田市地見興屋1-11-19地見興屋ランド106,横川莉央,2,9,14
株式会社アプローズイーグル,宮崎県都城市高崎町縄瀬3-8高崎町縄瀬ステーション410,井出優香,2,9,4
ビクトリーみらい株式会社,岐阜県飛騨市河合町稲越1-3,相馬千夏,2,11,7
株式会社タムラ幸和,和歌山県日高郡印南町古屋4-18,小笠原義夫,2,12,30
株式会社新栄ダイイチ,京都府相楽郡精華町柘榴1-10-5,杉本雪菜,2,9,24
石川商店ユニバース株式会社,鳥取県米子市岩倉町4-10ステーション岩倉町208,片山杏菜,2,12,23
株式会社橋本ネクステージ,京都府京都市伏見区醍醐柿原町4-15-20ゴールデン醍醐柿原町219,辻本芽生,2,11,12
新栄石川商事株式会社,徳島県那賀郡那賀町横谷1-18-5横谷フォレスト204,岩城信長,2,10,21
株式会社三幸ヒロ,大分県大分市王子南町4-2-19,雨宮良二,2,12,7
山口工務店ハイテック有限会社,長崎県諫早市土師野尾町1-16-8コンフォート土師野尾町102,三島昌利,2,12,27
有限会社リアル岡田商店,奈良県大和郡山市千日町3-14,北原茉奈,2,8,19
株式会社コスモヤマダ,山梨県南都留郡道志村椿1-8-5,木村日出夫,2,12,3
株式会社アポロピース,広島県広島市東区尾長西2-13-18尾長西スカイ406,伊藤敦子,2,9,23
株式会社大栄伊藤工務店,秋田県にかほ市象潟町小烏島1-6-2象潟町小烏島グリーン403,竹田綾,2,11,16
株式会社山口商店ループ,富山県富山市二口町2-15-16二口町レジデンス407,李利恵,2,8,27
ホープフューチャー株式会社,愛媛県松山市道後多幸町3-12キャッスル道後多幸町209,栗田優那,2,10,30
サンタムラ株式会社,岡山県新見市井倉4-18,矢沢文人,2,8,15
株式会社誠和シンク,石川県白山市小柳町2-11-16,阿久津充,3,1,14
タクト葵株式会社,神奈川県相模原市中央区南橋本2-16-7南橋本の杜409,沢啓介,2,10,13
合同会社アンビシャス協和産業,東京都江戸川区東葛西4-9-3,河崎果凛,2,9,24
テイクノーブル株式会社,和歌山県和歌山市田野2-16,村瀬浩秋,2,8,20
アクセルベルウッド株式会社,鳥取県西伯郡大山町御来屋3-12-15御来屋アパート218,小島素子,2,9,30
株式会社大洋山田屋,宮崎県日南市南郷町榎原4-20,菊地喜太郎,2,10,15
シンコーイズム有限会社,千葉県野田市桐ケ作3-6,小高秀夫,2,7,16
大栄商事ユニオン株式会社,北海道留萌市元町2-19,柳原冨美子,2,8,25
テクノス中村建設株式会社,東京都世田谷区砧公園3-12-13ヴィレッジ砧公園419,滋賀心乃葉,2,9,10
プロシードクレア株式会社,大阪府茨木市東安威3-9,今井光義,2,12,3
シンエイ中山商合同会社,神奈川県横浜市旭区今宿東町4-18,森口幸四郎,2,8,24
小林商店田中建設株式会社,石川県七尾市鵜浦町3-14,寺岡秀一,2,12,25
株式会社ファミリーアズマ,北海道稚内市末広1-12-8,竹田直也,2,9,27
アズマアーク株式会社,兵庫県多可郡多可町八千代区門田1-14,藤野真奈,2,8,20
リバースフォーチュン株式会社,岡山県岡山市北区中牧4-5中牧コート317,東山久道,2,9,26
株式会社グリーンファインテック,山梨県大月市初狩町下初狩4-4-7,羽鳥哲男,2,11,25
株式会社フジックスダイコー,沖縄県国頭郡本部町山里1-15-6,青柳梨紗,2,9,5
株式会社吉祥共生,北海道上川郡清水町本通西1-12-10,横井朋美,2,9,16
株式会社ネクサスライト,熊本県菊池市七城町水次4-19-13タウン七城町水次219,林龍也,2,7,17
エスト三友商事有限会社,和歌山県田辺市本宮町土河屋1-13-5,長瀬進,2,12,10
ヒロエムケイ株式会社,山梨県南巨摩郡身延町梅平1-4梅平メゾン414,岡本政信,2,10,11
合同会社コトブキ栄,静岡県掛川市沢田2-3-10,浅見鑑,2,9,20
飛鳥リアライズ株式会社,滋賀県高島市マキノ町浦3-6-2グランドマキノ町浦109,広川依子,2,11,3
ループ高橋合同会社,福島県いわき市三沢町3-3,若林清三,3,1,11
アクロステイクワン株式会社,鳥取県米子市岡成3-11-2岡成プラチナ408,松島碧透,2,7,22
あおぞらダイイチ株式会社,千葉県柏市布施新町1-18-18布施新町マンション100,末永果歩,2,8,25
株式会社高橋建設ダイケン,新潟県新潟市西蒲区国見1-13-13コート国見214,椎名竜夫,2,11,14
株式会社ワークスエクシード ,香川県東かがわ市入野山4-7,西島貴利也,2,8,20
サイトウステップ株式会社,鳥取県岩美郡岩美町唐川1-1-20唐川ドリーム419,飛田友香,2,10,23
株式会社幸三陽,青森県黒石市弥生町1-4弥生町レジデンス215,生田佐一,2,8,10
大洋三共合同会社,栃木県那須塩原市清住町3-6-10清住町ヒル101,川井悟,2,10,10
サカイクリア株式会社,三重県桑名市北川原台3-20-1,伊藤雫,2,12,14
金子商店アクティブ株式会社,長野県飯山市飯山3-12-10飯山レジデンス103,高倉美優,2,10,18
佐々木工業明日香株式会社,石川県加賀市山代温泉桜町1-19ヴィレッジ山代温泉桜町310,丹野薫,2,12,3
サクセス和興有限会社,千葉県夷隅郡大多喜町紺屋2-14-11,安東政人,2,11,13
株式会社ヤマキユウキ,福井県福井市灯明寺町1-20-15,松原花華,2,10,25
株式会社伸栄ホクト,奈良県奈良市中貫町1-15-17中貫町フォレスト118,上条和馬,2,7,15
アースケイアンドケイ株式会社,長野県飯田市吾妻町1-13-18,高嶋雅典,2,7,28
株式会社ラポール創和,茨城県水戸市小泉町2-4-4コーポ小泉町107,長谷部真吉,2,8,21
アサヒヤマイチ株式会社,佐賀県唐津市魚屋町3-1,西山華凛,2,9,7
株式会社リーフ光,三重県伊賀市緑ケ丘中町1-4-20緑ケ丘中町コーポ410,今昌一郎,2,12,21
プロシードタムラ株式会社,奈良県吉野郡十津川村永井3-4-4,森本烈,2,12,18
ユーアイムラタ株式会社,山梨県山梨市三富下荻原2-16-10,西岡日奈,2,10,24
豊和エフテック株式会社,佐賀県唐津市浦3-15-17リバーサイド浦114,倉橋葉月,2,12,26
アルファーアイコンボ株式会社,秋田県大仙市刈和野3-8-7,浜田良三,2,8,9
平成テクノシステム株式会社,大分県日田市殿町3-13,林祐子,2,12,9
有限会社オーテックアイネット,大分県由布市挾間町谷4-2,梶原紗菜,2,9,21
有限会社ハートランド吉田商事,兵庫県姫路市網干区坂出3-19-8網干区坂出ゴールデン302,上杉沙弥,3,1,4
株式会社三和建設ノーブル,山梨県山梨市牧丘町室伏4-7-4牧丘町室伏グランド107,福島源治,2,11,30
ハシモト光栄株式会社,三重県多気郡多気町上出江4-18-5,浜本昭,2,9,16
株式会社大輝サンフラワー,徳島県鳴門市瀬戸町大島田4-20ハウス瀬戸町大島田401,植田颯雅,2,8,18
有限会社渡辺商事プレジール,広島県尾道市西御所町2-6ステーション西御所町219,大坪桃花,2,9,4
合資会社日東商事モリタ,神奈川県横須賀市米が浜通4-11-15,杉田英倫,2,12,14
レックイマジン合同会社,山梨県北杜市高根町村山西割3-13-4,小川佳那子,2,8,22
ウイルワコー株式会社,徳島県海部郡海陽町船津3-1-12,鹿野市太郎,2,7,27
株式会社フラットオリーブ,和歌山県東牟婁郡古座川町大桑4-12-12,海老原俊明,2,12,28
ゴールド新栄商事株式会社,新潟県柏崎市西山町和田4-14-10,恩田亜沙美,3,1,3
マツモトオネスト株式会社,和歌山県和歌山市吉礼3-10-12吉礼の杜202,仲村好子,2,9,1
トップス三共株式会社,大分県玖珠郡九重町粟野1-8-15,手塚正俊,2,7,25
アイシスエーワン有限会社,鹿児島県曽於市財部町南俣2-18-1ザ財部町南俣202,森勇夫,2,10,18
株式会社リライアンス藤和,岡山県倉敷市祐安4-17,山村雅江,2,12,20
合同会社ノアトライアングル,熊本県玉名郡和水町大田黒1-20,大西房子,2,9,4
TMC匠株式会社,宮崎県児湯郡都農町川北4-12川北グランド208,飯塚真澄,2,9,16
マツモトフタバ株式会社,青森県三戸郡五戸町扇田1-2メゾン扇田202,曽我伊吹,2,10,30
サクセスセイコー株式会社,岡山県苫田郡鏡野町至孝農4-12-18,鈴木啓之,2,11,16
株式会社アイテック日昇,奈良県北葛城郡広陵町古寺3-1-4ガーデン古寺215,恩田博子,2,10,5
田中建設フォース合同会社,大阪府大阪市鶴見区緑4-7-7,浜愛海,2,8,1
合同会社栄和フレンズ,秋田県仙北市角館町鳥木沢3-14-4,藤田南,3,1,7
株式会社サカエリンクス,静岡県島田市日之出町2-18-3,小川克彦,2,10,12
フジタ東海合名会社,群馬県伊勢崎市東小保方町3-14-6,秋山三雄,2,8,26
株式会社和光マルタカ,山梨県南アルプス市榎原1-10,岩間敦,2,9,29
オンリーワン旭商事有限会社,岩手県一関市城内3-4,上村眞子,2,10,15
ミック井上建設株式会社,京都府京都市下京区坊門中之町1-20-9,玉城朋美,2,9,4
サポートアスク株式会社,熊本県玉名郡玉東町白木1-6-19,川田昌己,2,10,14
シバタライフテック株式会社,埼玉県鶴ヶ島市松ヶ丘3-16-19グランド松ヶ丘416,赤塚藤雄,2,8,4
有限会社中村組日光,長崎県諫早市本町4-12-7本町コンフォート400,須賀涼花,2,12,2
株式会社オオタアトム,千葉県旭市野中4-15-15,三木航平,2,10,3
サカモトサン企画株式会社,岩手県八幡平市左妻3-1-4メゾン左妻403,坂本栞奈,2,8,8
キューブ日光商事株式会社,愛知県尾張旭市西大道町五輪塚4-17-4西大道町五輪塚スカイ311,岩城重信,2,10,27
田中組藤和株式会社,東京都豊島区南池袋2-12-2,久保田有彩,2,10,22
株式会社アイ・コーポレーションビーンズ,千葉県旭市倉橋2-7-2,亀山正道,2,11,3
株式会社大成工業和楽,宮城県栗原市瀬峰蔵王3-20-13,吉村豊作,2,12,30
丸喜ヒロ・コーポレーション株式会社,青森県弘前市北横町2-18-3,高柳里奈,2,9,20
なかむら前田商店有限会社,福岡県遠賀郡水巻町高松2-3高松メゾン111,佐伯義美,2,11,2
株式会社匠光和,群馬県太田市泉町3-10-16,結城靖彦,2,7,28
フジイグレース株式会社,鳥取県西伯郡南部町宮前2-10宮前ランド411,小幡理緒,2,11,23
株式会社和光商事フラット,三重県津市安濃町川西2-2-11,神山耕筰,2,12,25
有限会社RISE陽光,鳥取県鳥取市国府町菅野2-12-13,後藤亀太郎,3,1,12
株式会社エスプリリッツ,栃木県那須郡那須町高久乙4-14,柴田虎雄,2,11,15
ヤマモトプレステージ株式会社,和歌山県東牟婁郡那智勝浦町中ノ川3-16-6コーポ中ノ川112,長谷部信玄,2,12,22
大和商事マルイ株式会社,熊本県阿蘇市一の宮町坂梨4-20-2シティ一の宮町坂梨100,木内綾菜,2,8,13
高橋製作所アイ株式会社,山梨県南都留郡西桂町小沼2-5-15,安井順一,2,9,25
有限会社グッドライフ清和,大分県中津市八幡町3-17八幡町プラチナ213,岩永久寛,2,11,28
サンテクノアルク有限会社,兵庫県西脇市平野町2-12-13平野町アパート415,佐川柚希,2,12,4
グロースメック株式会社,宮崎県都城市郡元3-1,桜井真樹,2,9,19
株式会社ナガイヤマグチ,熊本県山鹿市宗方3-11,新保司,2,9,18
ヤマキアポロ株式会社,宮崎県日向市亀崎西4-1-20,長谷部留子,2,11,27
有限会社清水商事オンリーワン,宮城県気仙沼市本吉町狼の巣2-10本吉町狼の巣シーサイド307,植松重吉,2,7,17
マーキュリー未来有限会社,高知県高岡郡日高村本郷1-1-8本郷アパート103,野崎悠奈,3,1,11
マルミサンシャイン株式会社,香川県丸亀市中府町2-16-18ガーデン中府町302,本橋祐一郎,2,9,21
山口工務店エム企画株式会社,佐賀県伊万里市山代町久原1-18-5グランド山代町久原106,田畑尚美,2,12,28
株式会社なごみ加藤製作所,神奈川県横浜市中区元町2-20,岡本莉桜,2,12,3
高橋建設アルク株式会社,静岡県静岡市葵区口仙俣4-8-8,川村麻衣子,2,11,18
株式会社マエダユーアイ,北海道空知郡南幌町南１６線西1-17-8,熊倉鉄太郎,2,10,17
有限会社シマダフジイ,東京都新宿区二十騎町3-13-18,瀬尾洋平,2,9,2
マルサンノーブル株式会社,沖縄県浦添市伊祖4-15-6伊祖パーク304,岡山博満,2,11,25
ワタナベメイプル株式会社,新潟県長岡市麻生田町4-8-10,矢口敬子,2,10,25
合同会社オネストソレイユ,徳島県鳴門市瀬戸町撫佐1-5-6,平田晴雄,2,12,5
株式会社SKYサイトウ,滋賀県長浜市高月町落川4-18,吉沢梨紗,2,7,30
共栄商事三和商事株式会社,愛媛県伊予郡松前町筒井4-7-11ロイヤル筒井405,木本信子,2,9,22
有限会社吉田工務店山口,千葉県我孫子市布佐下新田1-16布佐下新田ランド105,沢柚希,2,12,23
株式会社フジイフォーシーズン,石川県金沢市間明町3-9-6,小椋耕一,2,9,8
昭和産業ダイシン株式会社,千葉県香取市大崎1-15-14グランド大崎115,岩沢凛花,2,9,23
株式会社幸栄エイブル,高知県高岡郡四万十町大井野1-11-15大井野ヴィレッジ108,庄司冬奈,2,9,5
株式会社サンセイ佐藤商事,京都府京都市左京区一乗寺梅ノ木町3-12-12,倉持松男,2,12,20
株式会社マツダハラダ,大阪府泉佐野市土丸2-17-1,三上八重子,2,8,26
橋本商店大伸有限会社,福岡県京都郡苅田町京町2-16-17グランド京町304,曽根昭子,2,8,31
アイテックエヌテック株式会社,広島県広島市安芸区矢野新町2-13-4,山元一太郎,3,1,12
日昇みのり株式会社,山口県下松市瀬戸1-18-18瀬戸庵210,植松三男,2,8,1
吉田産業ウインズ株式会社,宮崎県都城市甲斐元町1-15甲斐元町プラザ114,鶴岡夏希,2,11,4
つるや大商有限会社,山口県下関市幡生宮の下町3-5-11パレス幡生宮の下町419,堀口美香,2,8,1
株式会社永和吉田建設,北海道上川郡東神楽町南１３号4-17,滝口広志,3,1,11
三和産業協和工業株式会社,岡山県津山市野介代2-18-8,島崎舞子,2,10,26
株式会社サンコーシンコー,宮城県仙台市宮城野区花京院通4-20-20花京院通グリーン406,大坪静夫,2,8,25
株式会社ウインズ松本,奈良県奈良市生琉里町3-10-20,江原喜久男,2,8,8
ダイシン井上商店有限会社,沖縄県那覇市大道3-2-14,氏家亜矢,2,10,6
株式会社グレイス山本産業,兵庫県佐用郡佐用町宗行2-18-12,今村菜帆,2,12,25
有限会社三興シナジー,山梨県南都留郡山中湖村平野4-15-9レジデンス平野309,清水顕子,2,9,6
高橋アルク株式会社,兵庫県神戸市灘区畑原通1-3-5,浜野忠正,3,1,8
合同会社藤工業加藤組,東京都千代田区神田三崎町2-18-1,濱田栄子,2,10,24
株式会社ウィズひかり,宮崎県東臼杵郡諸塚村家代4-16,下村風香,2,8,15
リアン山本商店株式会社,栃木県那須烏山市小塙1-15-9スイート小塙412,田所美姫,2,8,8
株式会社プログレスマルヤマ,鹿児島県鹿屋市輝北町上百引3-5ロイヤル輝北町上百引409,萩原聖,2,9,5
株式会社みやび旭産業,大分県国東市国東町小原1-13ハイツ国東町小原206,藤島長太郎,2,9,4
光栄遠藤商店株式会社,茨城県龍ケ崎市米町2-19-9米町テラス214,安藤勝子,2,10,11
アーバンナイス株式会社,神奈川県茅ヶ崎市甘沼4-17-15甘沼ヴィレッジ312,藤原登,2,7,24
株式会社メックリラック,京都府京都市右京区嵯峨野千代ノ道町2-4-17嵯峨野千代ノ道町ヒル206,星野音羽,2,11,3
イトウサンエイ合同会社,高知県四万十市生ノ川2-4-19生ノ川マンション405,大澤道男,2,12,1
株式会社鈴木工業三友商事,奈良県吉野郡下市町小路3-1-2,園田和代,2,10,1
渡辺建設東洋商事株式会社,佐賀県伊万里市波多津町井野尾2-2-16波多津町井野尾アパート208,深沢照男,2,11,13
創美共栄商事有限会社,宮城県石巻市大瓜1-8-4大瓜テラス210,川添小雪,3,1,4
株式会社アクロスペガサス,東京都新宿区二十騎町3-1,大沢徳太郎,2,9,10
ライフデザインウチダ有限会社,沖縄県南城市玉城堀川3-10,杉田佐一,2,7,25
株式会社スギヤマ佐々木工業,福岡県大牟田市本町1-9プラチナ本町218,稲村武史,2,10,15
